tweet,sentiment
bayadır mesaj gelmiyodu bugün mesaj geldi tabi ben bir heyecanla açtım ekran kilidini bilin bakalım evet doğru bildiniz,olumsuz
,olumsuz
dümdük kamera arkası,olumsuz
ulan eskiden bin smsi yettiremezdik şimdi bileesaj yollamıyor hıag,olumsuz
mesaj atın demek yerine geç mesajsız kalma yavşak pislik,olumsuz
çekim gücüne sokayim,olumsuz
giderseniz bilin tuvalet şifresi fjdjdj sponsor sanırım djdjdndjdndndnd,olumsuz
benim listelerim güzel kimmiş,olumsuz
vodefone baglanti var gozukuyor lakin ttnet nede operatorlerin interneti buyuk skntida,olumsuz
gerçekten bumuydu güzel paketten sonra işi bozmakmıydı ciddiyetin,olumsuz
varsa değerli abonemizkontör yoksa sayın abonemiz,olumsuz
koskoca taksim restoraninizda sadece bir tane sarj noktasi olmasi garsonlarinizin sorumluluk almak istemiyoruz,olumsuz
kere bacının amına koyım,olumsuz
harbi diyorum adami sikiyo,olumsuz
vodafoneda başladığım hat macerama sonra bugün woopsa geçmis bulunmaktayım büyüklerde top oynamıs futbolcu gibiyim,olumsuz
gelen sana özel mesajını arkadaşımın telefonunda görünce anladım kimseye güvenilmeyeceğini EMONEG,olumsuz
tarifesi yapmıyorsun kadar cimri olma,olumsuz
sahur kampanyası duruyosa faturamı iptal edicem bilgilendirin,olumsuz
kazık yemekten iyi EMONEG,olumsuz
sağolsun yalnız bırakmıyo EMOPOS döşedi yine tlyi,olumsuz
bela okusam tobb etunun internetsizligine bela okursam dusunurken babamin verebilecegi tepkiler aklima geldi,olumsuz
ayki telefon faturam patladı gitti zengin oldu oyun almaktan,olumsuz
den taahhüt telefonun piyasa değerinden lira faiz yiyip aldıktan sonra ben gömülü resim kalıcı bağlantı,olumsuz
telefonum cekmiyo kafayı yicem allah tependen baksın,olumsuz
bana yürüyor gömülü resim kalıcı bağlantı,olumsuz
ulan ibne sahur paketi gece arası olurmu,olumsuz
çekim gücü bizim eve gelene kadar sanırım,olumsuz
reklamları gitgide egemen siyasal ideolojiyle aynı dili kullanmaya başladı peki marka ideolojiyi taşırsa daralması duracak,olumsuz
olmasa mesaj atan yok,olumsuz
saatte hat kapatılır abv,olumsuz
nın reklamına yaptığı gönderme mart ayının iyi kapağı bence,olumsuz
senin vinn gidi taaaaaaa yalanını sikiyim gece gece delirttin beni lan,olumsuz
turbo internetini kullanabilen varmı,olumsuz
caner yüzünden deki iğrenç ses kaydını kere dinledim aradığınız numaraya anda ulaşılamıyor lütfen,olumsuz
reklamındaki bir sarkiyla kiz tavlanabiliyorsa ben tum evi hoparlörle sarkilarla donatayim amk,olumsuz
koskoca listeye asi mavi şarkısını koymamışlar yazık yazık gömülü resim kalıcı bağlantı,olumsuz
…sizin yapacağınız işinkimse htc almasın kullanmasın,olumsuz
kısa surede aveaya gecis yapiyorum den hic bir sey olmaz gecmeyiniz gecittirmeyiniz,olumsuz
apple seni anladımda benden istiyor,olumsuz
sağolsun yalnız bırakmıyo beni canım yaa,olumsuz
bile mesaj atmıyor amına koyim yalnızlığa bak,olumsuz
tam serefsiz avusturalyadan turkiyeyi arayip ayda dakika konusuyorum ödedigim fatura aylik,olumsuz
gücü cekmeyen gücü,olumsuz
kızlar koridorda telefonla konuşabiliyor bem konuşamıyorum abv,olumsuz
iktidar aleyhine yazilar paylasanlarin telefonlarini sebepsiz yere kapatiyor yogun sikayetler var takip edelim,olumsuz
hata onda değil bende alışkanlıktı artık türlü bırakamadım umarım bana unutturur,olumsuz
sim kartım yarında gelmezse bayisini yakıcam,olumsuz
ablama eski günlerimizi özledikdiye mesaj atmış allahım yaaa,olumsuz
türkcell olmasa valla mesaj atan yok canım bitanesin aşıgım sana,olumsuz
geçen yıla göre turktelekomun karı düşmüş sadece toplantılarını dakka sınırlasalar eski haline döner EMOPOS,olumsuz
yapma ayın öğrenciyiz yik tin beni hofs✋ gömülü resim kalıcı bağlantı,olumsuz
eceye benden baska kimse mesaj atmasinturkcell,olumsuz
ülker koca markaların reklam sorumluları kimdir acaba hayatları var saçma reklamlara güzel deyip yayınlatıyor,olumsuz
gecen vodafona kizdim num tasyacam dedim çekmiyor sıkntılı pahalı baktim hesapli vazgctm fakirlik kanima islemis,olumsuz
i̇lişki durumum cevapsızsa annemdir mesajsa,olumsuz
amerikadan birini çaldırmak bana mal oldu sağol,olumsuz
dağın başında çeken odamın içinde çekmiyor,olumsuz
asker temalı reklam filminin müziği ömrümde dinlediğim kötü miksajı kötü oluşundan beter,olumsuz
sen yerin dibinde dahi çekmen lazım davranmayı kes,olumsuz
halen kalan varmi ki̇ akp koyduğu batırıyor,olumsuz
alo polis evet buyrun beni tehtit ediyorlar ediyor yükleme yapmazsan hattını kapatırım diyor,olumsuz
evet arkadaşlar dağda bayırda çekiyor hastahanenin çekmiyor,olumsuz
benzinleyip ateşe vericem yemin ederim,olumsuz
müzik belasına kaldık fizy yokken harbiden sinir bozucu,olumsuz
size fakir mesaj atıyo dimi bana ttnet zaaaxd,olumsuz
reklamışimdide kar maymunu belgeseli izleyip ağlamadığm kalmıştı tam oldu yemin ediyorum dur bakalım nelere ağlıcam deliricem,olumsuz
hayat paylaşınca güzel diyen sertap erener madem öyle aldığın reklam parasını bizimle paylaşsana,olumsuz
sen çekmezsin,olumsuz
ciliv doneminde avrupanin hzli buyuyen telekom grubuyken ilk ceyrekte kâri azaldisiyaset yuzunden elimizdekindende oluyoruz,olumsuz
sen dakikalarını harcamaya kıyamazsın son gün gelir bitirmeye çalışırsın kalan son insafsızca alır,olumsuz
genç deki gencaver bile derdime çare bulamiyo kimsiniz,olumsuz
müşteri hizmetlerine ulaşmak cumhurbaşkanına ulaşmaktan zor teşekkürler,olumsuz
paketim bitti kapalı semt,olumsuz
zaten saatte atsa atsa anca mesaj atar,olumsuz
saatte kontorlerimi cekiyon amk,olumsuz
facebookta turkcell parmak int reklam filmleri albümünde yeni fotoğraf paylaştım,olumsuz
reklamını beğeniyosunuz bence itici,olumsuz
arkadaşımın isyanı doruklarda lan bile cevap vermiyor fotoğrafı görüntüle retweet favori,olumsuz
şew ßaş arkadaslar yaw size bişey soracam aranizda facebook paketinden anlayan var aranizda ben,olumsuz
biçim abisini gün kuruş çekilir mii hattann,olumsuz
telefonu kapattıktan sonra spam birden geldi çalışan genç gazımı alıp eğlendi herhalde kesin fitnenin başı,olumsuz
bugün spam mesajlar yüzünden aradım kusura bakmayın falan dediler bundan sonra gelmez engelledik dediler,olumsuz
yeni yıllık abonelikte ücret yıllık bana indirim yok zaman elveda,olumsuz
min olmadigini bile bile bana hâlâ sorular sorup kazanabilecegimi söylüyor fakirliğin dibini sıyırıyorum,olumsuz
vodafonene avearakı bir gsm operatörü değildir amasizi insana bağlar gömülü resim kalıcı bağlantı,olumsuz
gerçekten yazıklar olsun yarın ilk işim bay bay demek olacak,olumsuz
bana mesaj atmadan uyuyamıyor yüzden önce mesaj attı,olumsuz
new post fatura itiraz dilekçesi örneği …özeti görüntüle retweet favori,olumsuz
reklamındaki kız susmuyor susmuyor televizyonu kapatıyorum görünce,olumsuz
bana kazık atıyoo,olumsuz
sağladığı salyangoz hızında internete rağmen lansmanı yapmaya utanmayacak,olumsuz
internet paketim yenilenmesine gun kala bitmis sen bana sormadan internet paketi yapiyon yine lira fatura ödicem,olumsuz
neti çekmeyen babannesi kaşar,olumsuz
artık yerine mesajları gömülü resim kalıcı bağlantı,olumsuz
bile mesaj atmıyor yalnız konuşmayalım istersen,olumsuz
zaten ben haksızım sen haklısın türk telekom sevgilim hadi hahahaahahahahaha,olumsuz
mesajına diss atiyim,olumsuz
bide bağlan hayat derler,olumsuz
reklamlarında newyork kanada orası burası çekim gücü saymayı biliyorsunuzda ben internete giremiyorum,olumsuz
geçen kontör yukledim aldılar yüzden yuklemiyorum arkadaşlar lanetli,olumsuz
son bir aydır dialupa döndü edge bile hızlıydı zamanında,olumsuz
i̇nternet paketimi yenilemeyen abv,olumsuz
sinan engin ertem şener mesaj geldi diyip duruyo dakikada bir mesaj geliyo bizede bilmemneden geliyo,olumsuz
internet yollamış sonra geçiririm düşünüyo acabaaa,olumsuz
nin inanılmaz hızı hakkında reklam yapıyo fun runda oyundan düşüyoruz,olumsuz
tarife mesajları gönderip duruyor telefonu kullan artık demek istiyor heralde yemezler,olumsuz
fakiri ben EMONEG sjsklfdshg,olumsuz
sen olsan kullanirmiydin deli̇kanli gi̇bi̇,olumsuz
neymis efendim dagda bayirda cayirda cekiyormus tevv oda biseymi bizim sofiler heryerde ceker kurban,olumsuz
silivride çektiğin kadar birde köyden çeksen EMOPOS,olumsuz
yas alti kampanyalrini yas ustu gelin adaylrina uyarlasniz keske gelin paketi mesla eve katkiniz olur sevap EMOPOS,olumsuz
alo polis evet buyrun beni tehtit ediyorlar ediyor yükleme yapmazsan hattını kapatırım diyor,olumsuz
kıza benden başka kimse mesaj atmasın,olumsuz
i̇zmirde interneti hizli olan hat hangisi lasu kullaniyorum fakat gecesim var yardimci olun,olumsuz
kuşadası caferli cep telefonları çekmediği çocuklarımız anteni başlarına taktılar alır,olumsuz
koca temsilcisi avukat tefeci merak ettim,olumsuz
alo polis evet buyrun beni tehdit ediyorlar ediyor yükleme yapmasan hattını kapatırım diyo,olumsuz
sevgili hukuk burondakiler ekmek aldigim firina kadar aricam diyorbu ustu kapali tehdit suc dimi tck gore,olumsuz
ahmete benden başka kimse mesaj atmasın turkcell,olumsuz
lira yükledim tane bilgi mesajı geldi amk galiba genel merkezde halay çekiyolar,olumsuz
disari şapkasiyla çikip uzayliya benzeyen yaşlarinda çocuk desemmm ppp,olumsuz
telefonum çalarsa annem mesajsa turkcell ödemeliyse kankam,olumsuz
bide diyolar çekiyor nah çekiyor,olumsuz
i̇yi geceler üyeleri sinirliyimoparetörüm hani olan kazıklamanın dibine vurdu bugün,olumsuz
ben beni gnctrkcllden çıkardığını sene sonra işim düşünce öğrendiydim tabiki yaşımı hissetmiyorum,olumsuz
reklamında çocuklarin bin ucuz rakamda oynatiklarini tartışırken kendimi ben beşyüze eyvallahım derken buldum,olumsuz
dışında sms para kazanan diğer şirketin adı acun media amk,olumsuz
beni int paketi yapmaya iten şıaan mutlu,olumsuz
bir illetse artık tarifelerde fark atıyor millet yine vazgeçemiyor sırrı düşündürücü,olumsuz
numaram yillarca kaziklandim tasidim rahat ettim valla,olumsuz
sikecem super onlineyi amk,olumsuz
bip uygulamasını kullanan avealıyımyine çılgınlıklar,olumsuz
itibariyle aldattım şimdi düşünsün,olumsuz
bugun yukledim sahtekari cekmedem merve turboya sms aticam bidaha cekersen sktim belani,olumsuz
çalışıp avealı olduğumu fark eden patronun attığı bakış,olumsuz
reklamindaki espri yaptirdiklarni sandiklari teyze asiri itici degil reklam ciktiginda ekrana elimde varsa atmak istiyorum,olumsuz
kullanmak ayllık gelirin olması gerekiyor amk,olumsuz
artık bayilerinde beyin fonksiyonları düzgün çalışan insanları işe alsınlar lütfen iki bir sinir krizi geçirmekten yıl dım,olumsuz
den kalmak nedir boyle falan olmaz olsun,olumsuz
tefecisinden anlayan arkadaş varmı,olumsuz
bugün kadar gezdim bir tane bile açık olmaz,olumsuz
ailedeki herkeş vodafonea geçti i̇nternetim olmasın hala internet yapamayacak kadar fakir gururluyum,olumsuz
telefonum çalıyor mesaj atıyor facebooktan oyun isteği geliyor sanırım öldüm ben haberim yok,olumsuz
ulan kontör attık hepsini yedin,olumsuz
kullanim kosullarina sokayim kirk yilin basi beles internet ariyoz onda kullanim kosullarini sokuyon gozumuze,olumsuz
güzelsin mutlu sanıyorlar kullanıyorsun yer çekiyor sanıyorlarbesiktaslısın şampiyon sanıyorlars,olumsuz
müşteri hizmetleri zaman sınır tanımıyor internet ayarları beni arıyorlar,olumsuz
kullanılmaya başladığım güne lanet olsun parasıyla rezil olmak,olumsuz
paketim yok iki net açayım dedim sömürdü,olumsuz
kumlada mobil bağlantı sorunu yaşayan kişi var haftasonu kısaca abv vodafone sizin yapacağınız işi,olumsuz
zaten çalışıyoruz garden cafe,olumsuz
lanet,olumsuz
konuşmuşumda fatura gelmiş benim faturayı dövizle hesaplıyor kardeşim,olumsuz
dur bir mesaj atalım sevgilisinden zannetsin,olumsuz
tam birisinden msj beklersin gelir heyecanla telefona kosup mesajina bakarsin gönderen kişi tahmin edin,olumsuz
yeni geçenlere yaptığınız kampanyalar güzel yıllık müşterilerinizi düşünmezsiniz,olumsuz
soyliyimde bizim köye baz istasyonu yapsin boyle olmaz internetin olmamasi demek yaa,olumsuz
tamam misafirliğe katlanabilirim telefonun düzgün çekmemesi beni kanser ediyo tweet yarım saate anca gider,olumsuz
ben telefonu sadece mesajlarini okumak almadım almadılar bilmem alabilirlerde,olumsuz
hayat reklami kadar saçma,olumsuz
son reklamı resmen çirkin reklam listesinin başında öyle off,olumsuz
kadar orospusu yok,olumsuz
misket havasiyla desteklediği yeni çekim gücü reklami hangi kafa yapılmış,olumsuz
faturayı ödediğim halde hattım açılmıyor,olumsuz
hayatsırf amerikadan güçlü çekim gücümüz olduğunu belirtmek zenci adamlara misket havası oynatan zihniyeti kadar saçma,olumsuz
hic bir yerde cekmiyor cek yor,olumsuz
yaziklar olsun senelik hatlar bile taahhüt telefon kullaniyorken bana verilmemesi cok saygisizca,olumsuz
biçim reklam,olumsuz
yeni reklamları yeni kurumsal kimliklerinin ghettolugunu yansıtıyor acaba,olumsuz
reklaminda zenciler misket oynuyor bayilacaaaam sinirim bozuldu gapat gapat,olumsuz
digitürk büyük bir protestoyu hak ediyor gömülü resim kalıcı bağlantı,olumsuz
ayıp sana karanlıkta çekmeyen bile senden iyi çekiyor burada,olumsuz
allah belani versin paragöz,olumsuz
demek borcunuz var kendine gell,olumsuz
lan bir hayat yaşıyorsun gidip rehberden isim sildirme yapıyor bana sökmüyor egm anca adam öldürüyor komik ülke,olumsuz
yemin ederim kazık,olumsuz
digitürk büyük bir protestoyu hak ediyor gömülü resim kalıcı bağlantı,olumsuz
cekim gucu amerikayi gectiannemgel bak arka odaya cekiyomus gor amerikayi gecmismis,olumsuz
kime yeter allah belasini versin,olumsuz
müthiş kampanya hattınızı geçirin size geçirelim,olumsuz
kazığı kurumsal hattan bireysel hatta geçmek istediğimi söylediğimde anında internet paketimi iptal edip sonrasında ikametgah,olumsuz
aydır kontör yüklemiyorum lira borcum varmis sie ödemicem,olumsuz
şuan büyük hayal kırıklığı olmadı zamansız mesaj atıyorsun atma,olumsuz
iciyo yaa allah askina son reklam slogani cekim gucunde amerikanin onundeyiz,olumsuz
misket oynayan rapçi zenciler dog aramaya çalışıyor telefon çekmiyor evet bir reklamı,olumsuz
reklamıankara misket oynayan zencilerturkcell çekim reklama bakilirsa ben abd bir zenciyim,olumsuz
tatil sonrası dram işte i̇zmir plaza i̇zmir türkiye,olumsuz
zorunlu pop mesajlari sayesinde olarak musterilerinize zorla biseyleri onaylatiyorsunuz,olumsuz
projeksiyon kampanyası tam beklediğim gibi hız verip kota koymak hızla kotanın var anladık,olumsuz
internetinin hızlı olduğu tamamen şehir efsanesi kat hızlı denedim heryerde turkcel berbat,olumsuz
işportacılığa başlamış,olumsuz
kendim kullanmadığımız etrafımda ailem yakınlarıma kullandırtmam senin zihniyetin habire geçirmek yazık,olumsuz
bir hat almakmı allah korusun yaşasın ticari kaygı düşünmeyen güçlü sen yaşa,olumsuz
git işine,olumsuz
resmen hat değil sıkıntı dert aldik,olumsuz
pazarlar kaybolsaa demsan karasu sakarya,olumsuz
kadar para verip kullanılmış numara satın aldim teşekkürler,olumsuz
paket yapcaktım bikaç aldığı tekrar yükledim,olumsuz
tlfmu buyaka bayii aytel aracılığıyla kartal kvk merkezine teslim ettim çüzün ltfn,olumsuz
gün aranıp rahatsız edildiğim tez zamanda allah belanızı verir inşallah,olumsuz
telefonuna gelen mesaji hemen açiyorsan bekledigin vardir dakika sonra açiyorsan pek önemsemiyorsun dur bakmiyorsan,olumsuz
ben eşim defalarca çalışanlarıyla konuştuk durumu anlattık bizi icraya verdiniz bir zaman,olumsuz
sen iflah olmaz bir kazıkçısın,olumsuz
yanında kalıyoruz fatura üzerinden telefon aldık ilk faturaları ödedik yasaklar başlayınca faturaları ödeymedik,olumsuz
itibariyle fatura takipten kalandan tane msj geldibu kdr msja gerek var,olumsuz
wifiimiz calismiyor musteri hizmetlerini aradim izmir geneli internet kesintisi vardir bant kaydi yayinladilar,olumsuz
bile bicok yerde cekmeyebiliyor nasil dunya oldu,olumsuz
inadına kullanıyorum almayacağım inat değil senden nefret ediyorum bir beşiktaşlı olarak,olumsuz
kaç bit bayt eder desen polise ihbar eder mbps dediklerinde sevinçten havaya uçuyor anladın sen anlatsana,olumsuz
binasında aveanın çekmemesi,olumsuz
sevdiklerimle dakika yapmadan rahat rahat konusamazmiyim delirme beni,olumsuz
pazar pazar i̇zmir plaza i̇zmir türkiye,olumsuz
ben yarın işe gidicem sefer kovacak beni,olumsuz
değildik çektik,olumsuz
bezdirdin artık,olumsuz
faturalı hat kullanmayın adamlar küfür yiyenler sıralamasında ilk olmak dev çaba harcıyor,olumsuz
arasindaki savasa taniklik etmek istemezsiniz,olumsuz
günde internet paketi bitiyor günlüğüne bir fatura parasına internet aldık ahh ahh,olumsuz
sabah sabah manita mesajıyla uyanmak yerine mesajıyla uyanıyorum ilahi adalet,olumsuz
yil olmus saatlerdr olmasina ragmen sebeke yok net cekmiyor dogru durust nasil istir,olumsuz
istanbulun göbeğinde çekmeyen keyfi yapsak durumu,olumsuz
megabayt falan kalmadı amk videocusu brazzers kameramanımısın yeter bilader kuran çarpsın ağladı,olumsuz
yurtdışında yaşıyorum müşterisi değilim gene fatura alıyorum,olumsuz
baktı kız geceleri uyumuyor yapıştırdı kampanyayı şerefsiz sağol cnm ben almim,olumsuz
rahat birak beni gece bile mesaj atıyo arkadaş,olumsuz
bari israilcell yapında tam olsun,olumsuz
hım bugün kötüydü,olumsuz
sen wifi bağlı olduğunu sanıp saatlerce nette videofoto tıkladıktan sonra den gelen acı mesaj yüzleştin,olumsuz
parasıyla alamıyoz,olumsuz
cep telefonu soygununa son verilsin kampanyayı i̇mzala aracılığıyla,olumsuz
annemin siteye girdim çıkış yapamıyorum sitede mahsur kaldım acil yardım,olumsuz
allahım bir hattımı taşıyıp artı bir faturalı yapmış faturali,olumsuz
kaldı sizden kurtulacağım kaç kere oldu sizi uyardım edirne hamzabeyli köyünde çekmiyor kaale almıyorsunuz kaldı,olumsuz
utansin diyim,olumsuz
i̇lahi çekim problemim var diyorum yönlendiriyor beni millet geçiyor ben,olumsuz
abi benim internet yayında mobildeyken bile donuyo süperonline,olumsuz
aydır var çözemedim amk makinesini,olumsuz
uyumlu sim kart ücretsizmiş ücret talep eden gsm şirketi var,olumsuz
app store bağlanamıyor demek kullanıyoz oğlum ayak,olumsuz
gerek kalmadi boyunca yardimci olamadiniz yilin sonunda bye bye hirsiz,olumsuz
tabii ülkede yalandan bırak ölmeyi yalancı yaftası yediği görülmüş hükümetin ine laf edebilir,olumsuz
sayın twitter senin baban sahibi amk surekli mesaj,olumsuz
canlı hizmetteki uluhanla yakında evlenicez,olumsuz
olm yurtdışı direk gün ücretsiz paketi kullandırıyor,olumsuz
kendi hatasını bile kabul etmeyen valla yıldım,olumsuz
doğadanın yayından kaldırılan reklamıturkcellin soykırımdan bahsetmeyen özürüşimdi siemensin kamuoyu açıklamasıhouston sorun var,olumsuz
yetmiyoraynı sorunu internette beri şikayet eden bir sürü forum başlığı var umursamamış olmalıdolandırıcılığa imkan,olumsuz
müşterisi değilken kredi kartınızdan lira çekilmesi sizinle paylaşmadığı fatura numarasını size sorması,olumsuz
görüntüdeki maile benzer mail aldım i̇nsanları bilgilendirseniz iyi olur,olumsuz
annem gelsin arasın,olumsuz
tam soverken net gitti,olumsuz
yine lira fatura ödedim zalim,olumsuz
senin ben ananı avradını sikeyim iyi hat tahta kurulmuşsunuz inşallah batarsınız oruspu çocukları devran böyle gitmez,olumsuz
müşterileriyle dalga geçiyor öğlen aradım ulaşılabilir olduğum bilgisi arayanlara gitmesin dedim,olumsuz
demek telefon faturam şimdiden lira oldu ayı kapatıcam ben,olumsuz
bolunun seben ilçesinde saattir telefonlar çekmiyor geçen senede aynı durum olmuş gün sürmüşaçıklama,olumsuz
bir algoritma değiştirdi herhalde internet paketleri yarısı kadar dayanıyor artık,olumsuz
lanet olsun aşka lanet olsun sevgimize sen bana böle yaptin lanet olsun hayat hayatım,olumsuz
gerizekalılar i̇letişim merkezidayım bursada,olumsuz
kadar kalabalık insanların tek derdi telefon,olumsuz
kullanmıyor musun,olumsuz
telefonum evimde çekmiyor geçmek istiyorum cayma bedeli ödeyecek miyim,olumsuz
internetizinin yarısı kadar bizden size hediye diyorsunuz faturama geçiriyorsunuz hayırdır noldu bizim hediye,olumsuz
çıt çıktı noldu,olumsuz
dolandırıcıların son numarası adıyla sahte borç bilgisi gönderiyorlar,olumsuz
di̇kkat di̇kkat bilhassa fatura borcunuz var sahte epostaları gelmeye başladı sakın açmayın virüslü,olumsuz
defalarca fatura ödeme mail geldi gelmeye devam ediyor viral mailler,olumsuz
semanın işini göremeyince yalan servisi diyip soyleniyo size naapmalıyım EMONEG,olumsuz
i̇lgili arkadaşlar beni hatırla özelliği çalışmıyor eskiden girerdi otomatik girmiyor bilginize,olumsuz
onlara verilecegini zannetmiyorum türk telekom thy isimlerin sponsor olmasini isteriz,olumsuz
değil artık mesaj atmıyor,olumsuz
bana odun dediğiniz utanmalısınız erzurum global…,olumsuz
şikayette bulunuyoruz baz istasyonu kurulcak malınız varsa önersenize EMOPOS cevap geliyor müthi̇ş hi̇zmet,olumsuz
sana internet bırakıyorum ona iyi bak,olumsuz
itibari zigzakfon bir servistenturkcell ödeme sistemi ödeme alınmıştırbu benim onayım olmadan,olumsuz
numara astigmatla jilet eyeliner çeken ben lira fatura ödememe rağmen odamda çekmeyen,olumsuz
arkadasin faturasıni açtiktan sonra şirketin bütün sistemi çöktü buaralar maillerinize dikkat edin heran hacklenebilirsiniz,olumsuz
hay evden çekmiyor bence çikti fakirleri sikiyorlar,olumsuz
kazık aga,olumsuz
numarasıyla geçtim numarayi değiştirip numarasıyla aveaya geçtim şimdi,olumsuz
murat boz bozmadi reklami bucuk değil bucak reklami vaaay yaratici dimi,olumsuz
yedek sim istedik ankara kızılay bayiniz yok dedi aynı gün taşıdım sizden bir cacık olmaz,olumsuz
hat kullandığı halde virüs olarak gelen mailine tıklayan açık ara farkla maldır virüsleri hakeder,olumsuz
saat arasında hiçbir hat çekmedi kırıkkale yenişehirde kullananlar bile kadar uzun süre çile çekmedi,olumsuz
yediğim kazıklara rağmen hala kullanıyorum,olumsuz
aveaya geçtim kendimi yaşlanmış hissediyorum,olumsuz
lan ben deği̇li̇m ki̇,olumsuz
vallahi kafamı bozuyor internet yine bitti yine yine,olumsuz
sinirsiz internet paketime hayali bir sinir koyan serefsiz yuzunden uzulerek aranizdan ayriliyorum kiby,olumsuz
müşteri hizmetlerine ulaşmak survivorda yarışmaktan zor,olumsuz
firmadan kaçırttığınız müşterilerinize sorun kadar,olumsuz
yeni tecavüz sistemiturkcelle gidip para veriyorsun ordan bir kısmı derneğe aktarılıyor çocuğuna tecavüz ediliyor,olumsuz
parası yetmeyen boykot ediyo,olumsuz
kuruşum vardı onuda aldı,olumsuz
arkadaşımın turktelekom hattıyla benim hat arasında speedtestte benim hat nal topladı sebebi bilen EMONEG,olumsuz
gece den sonra internet bişi yapıyor amk yavaşlıyor,olumsuz
lenovo modeliniz desteklemiyoulan yeni yelefon satiyosunuz telefon tırt cikiyo,olumsuz
der uygulamadan bakbiri der olmaması gerek olmuşturkcelli bıraktığıma pişmn ettinizteşekkürler süper destek,olumsuz
internet göre yavaş,olumsuz
kullanan var telefon wifiden veriden internete bağlanmıyo napcam,olumsuz
tecavüze sponsor olma via,olumsuz
gitsin,olumsuz
pahalı,olumsuz
lik faturamı yapan zalım duyyyyyyy,olumsuz
açığı kesinlikle faturalara yansıtacaklarturkcell borçları patladı aracılığıyla,olumsuz
sen sin şehrin orta yerinde netin cekmemesi demek,olumsuz
saatde milleti sevgilisi arar beni,olumsuz
nah alir faturasini benden,olumsuz
inanmiyorsunuz gerçekten bütün servetimi vodafonea bağışladım ben böyle bişey görmedim amk,olumsuz
sen milyon ları den kazan sonra vadafone yapma yıldız ablaaaaa,olumsuz
kanal denilen embesil kanalda film izliyorumher dakikada dakika reklamlareklamın dakikası efendiler yiyin,olumsuz
hattımı taşıdığım dolmadan pişman ettiniz teşekkürler,olumsuz
müşteri hizmetleriniz rezalet ukala insanları çalıştırıyorsunuz ayrıca dolandırıcılığa göz yumuyorsunuz,olumsuz
bayisine gidip sevgilimden mesaj gelmiyor dedim sevgiliniz yok gözüküyor beyefendi dediler nasil olmaz dedim disari attilar,olumsuz
öyle hızlı çalişyor twittleri tek tek elden ele iletsem hızlı gidecek,olumsuz
arena arenadan sonra fenerbahçe stad ismini vermeyerek büyük bir stratejik yanlış yapmıştır,olumsuz
hırsızlığı,olumsuz
kaldı kayyum atanacak borçlarınız patladı,olumsuz
telefonun başında çaresiz bekliyorum bekliyorum çalmayacak biliyorum ara beni numaranı ver ben arayayım,olumsuz
sözde yakın zamanda ilgilenip dönüş yapıyordunuz merak etmeyin pazartesi geçince dönersiniz,olumsuz
orada mısın madem ben mağdur oldum rahatsız olun olmayan müşteri hizmetleri,olumsuz
tane call center konuşup sonuca varamamak kadar profesyonel olduğunuzu gösterdi teşekkürler,olumsuz
reklamı yayından kaldırılan tilbenin dramı,olumsuz
yurtdışına çıkıcam paket azaltmak istedim yapamadınız işlemi eşittir hayalkırıklığı,olumsuz
sen anı yaşarken ben seni heryerde cekemem yıldızcım,olumsuz
yildiz tilbe reklamini yayindan kaldirmasi kadar sacma bisey olamaz,olumsuz
gerisi tırt,olumsuz
abone olmayın oldurtmayın ülkede adam akıllı internet sağlayıcısı yok ısrarla modem değişmiyor,olumsuz
türkiye nin berbat rezil hizmet veren kuruluşu superonline dır,olumsuz
vodofon abla pişmanlık resmen,olumsuz
kesinlikle vodafone aveadan hâyır gelmez yıldız abla☺️,olumsuz
surekli yasadigimiz sikinti artik can sıkmaya basladi,olumsuz
