tweet,sentiment
ulan wifiye bağlıyım ben ona bağlıyken internet paketin bitti mesaj atabilir bana onu ödeyelim,olumsuz
internet sadece kaşar düşer çocukları,olumsuz
ayrıca reklamı kadar kötü bir reklam görmemiştim,olumsuz
pahalı,olumsuz
kaşta internetin cekmiyor,olumsuz
allah belası versin demek isterdim demicem demedim farzedin bir internettir yüreğim şişti,olumsuz
canın cehenneme,olumsuz
yönetimini eline geçiren akp hükümeti abonelere seçim propagandası mesajları gönderiyor,olumsuz
şerefsizdir aksini iddia eden,olumsuz
elimi ayağımı çektiğim iyi oldu,olumsuz
senin allah belanı versin,olumsuz
bayramdan sonra geçiyorum kazıkçı amk,olumsuz
evin köşesinden geçiyor bizi kazıklamalarıyla kalmayıp birde internetleri düşük hızlı,olumsuz
hay senin çekim gücünü nalet olsun,olumsuz
şehir dışındayım burada internet çekmiyor bide fuul çekiyor diyorlar,olumsuz
senin ben amk dakikalık videoyu izlemek icin yarım saat dolmasını bekliyorum,olumsuz
bağlanmak amerikaya gitmekten zor,olumsuz
durduk yere kac lirami yedi kafasina gore paralar cekiyo,olumsuz
lan saatte araman ayıp değil nalet,olumsuz
gittikçe iyice saçmalamaya başladım diyor,olumsuz
kendimi kurtardığıma sevindiğim kurumlar digiturk garanti,olumsuz
interneti kadar rezil bir olamaz,olumsuz
mal köyde çekmeyeceksen hiçbi yerde çekme,olumsuz
reklamlarında sürekli çocukları yerel değerleri kullanan ayar oluyorum,olumsuz
yaylada telefon çekmiyor sözde toroslarda çekiyor,olumsuz
sahrayıceditin göbeğinde tek çentik çeken dört geçmiş sen önce çekim gücünü yükselt sonra geçmesi kolay,olumsuz
kullanan geri zekalıdır i̇nterneti biraz hızlı lira vermek varken lira vereyim ams salak mıyım ben,olumsuz
türk operatörleri tıpkı abdeki operatör türevleri halka hediye olarak ürün sunmalı yıllardır halkı sömüren yaptı,olumsuz
müşteri hizmetleri kalitesi felaket şimdi face hesabımdan aynı yazıyı arkadaşlarımla paylaşacağım,olumsuz
malsın yaa ağzıma ettin ressmen,olumsuz
yapsa internet düzelmez bir fotoğrafın açılması yarım saat sürüyor,olumsuz
hani heryerde çekiyordu,olumsuz
benim hattım kendi üstümde deyil kazıklarından bıktım amk baba duy sesimi,olumsuz
kazık operatör aksini idda eden olmasın,olumsuz
kadar şerrefsiz operatör yok,olumsuz
çiftehan cekiyor,olumsuz
kadar mal operatör yok,olumsuz
numaramı değiştiriyorum yeter amk,olumsuz
cart parası curt parası sürekli faturama geçiren sana sövdüm,olumsuz
liraya sınırsız internet yaptırdım sanırım yine kazık attı yine keklendim arkadaşlar,olumsuz
köşede yavaşlıktan ölen bir adet,olumsuz
amk çekmiyor internet,olumsuz
çekmiyooo kahretsin,olumsuz
sömürüyor bildiğin,olumsuz
allah belanı versin,olumsuz
allah belasını versin ilk bedduamdır,olumsuz
yalan söyleyen sigortalı telefonumu sigorta kapsamında değil diyerek geri çeviren hala ses seda yok,olumsuz
eve geldim hala deki adama sinirim geçmedi,olumsuz
yerde çeker diyorsunuz lan evin ortasında şahin pozu aldım yine çekmiyor,olumsuz
gectigim icin pismanim,olumsuz
allahin belası kazık,olumsuz
i̇nternet paketini sömürüyor yine allahsız,olumsuz
geçtim evde çekmiyo,olumsuz
biçim sen şehirdeyim çekmiyor,olumsuz
klozette edge cekiyor sacmalik,olumsuz
abv odam bile çekmemeye başladın gerçekten,olumsuz
bok gibisin bok,olumsuz
urunu kullanirsam adi serefsizim,olumsuz
çekmiyor arkadaşlar inanmayın,olumsuz
allah belanı versin bin yaşa,olumsuz
söylesene odamda çekmiyorsun,olumsuz
bir oparetör dürüst değil faturama internet paketimi aşmışım kitledi sözde otamatik duracakdı sahtekarlar,olumsuz
ulan gerizekalı kardeşimin öldüğüne dair eve yazı yollamış,olumsuz
bitmeyen fatura yapmışlar ömrüm sizi ödemekle geçiyor heleki allah senin belanı tövbe tövbe,olumsuz
son zamanlarda iyice cortladı internet hızı rezalet yer yer çekmiyor kontratım bittiği vodafonea geçeceğim,olumsuz
yemediğim kazığı yedim lira yükledim gelin görünki elde var bir i̇message uyanıklığı var tabii,olumsuz
bugün mutluydum beni sinir etti şuanda,olumsuz
benim internetim hafta böyle yavaş,olumsuz
yıldım vallaha yıldım allah telefonumun belasını versin,olumsuz
internet bağlantı hızında açık ara sınıfta kaldı yazık eziyet çekmişim,olumsuz
yapmışlar olmamış,olumsuz
senedir kullanıyorum allah belani versin haram zıkkım olsun verdiğim paralar,olumsuz
samsun zor çekiyo adada çeksin bırakın ayakları,olumsuz
geçirdi beeee,olumsuz
galiba bana gelince internet paketini yavaşlatıyor,olumsuz
hani heryerde çekerdi metroda telefonla konuşamıyoruz bunu bana açıklasın,olumsuz
reklam mesajları numaramı sattıgın firma allah belanı versin,olumsuz
ulan odedigim faturalar haram olsun bole net hızı olmaz olsun,olumsuz
yemin ederim müşteri hizmetleri bir ton otistik moronla dolu,olumsuz
embesil saatte mesaj yollanır üstüste,olumsuz
çekim gücüne sövmemek zor tutuyorum kendimi,olumsuz
ömrümü yedin,olumsuz
gayrettepenin göbeğinde bırakın edge hızına bile erişemiyor neyin kandırmacası,olumsuz
lan odada çekmiyo geçtim şimdide çekmiyo full başlarım böyle işe,olumsuz
benim odamda telefon çekmiyor arkadaşlarturkcell resmen yıl geride yaşıyorum ben,olumsuz
hattımı tekrar alsam yoksa sefer denesem bulasmıyorum bile kafamda deli sorular,olumsuz
ayricaliklari neymis bakabilmek icin hattina muhtac olan ben evet dort ceker olayi yalanmis,olumsuz
reklamları kadınları kadar aşşağılıyor güllerin içinden yoksa vermez kucaktan kucağa zıplattılar kızı,olumsuz
türk telekom arena bile internetin kağnı gibisana verdiğim para haram olsun,olumsuz
kandırdın beni bitti,olumsuz
yaşasın yarın vodafonea geçme kararı aldım para yedirmeye son,olumsuz
ulan numara mekan sıcak suyum bile var şebekem yok amk vodafoneye geccem kesin,olumsuz
önemli şahıstan mesaj beklersin beklersin çat mesj gelir bir heyecanla bakarsın sonra olduğunu görünce söversin,olumsuz
senedir kullandığım numaramı vodafonea taşıdım gerçekten iyi karar oldu insanları sömürüyorlar ücretlendirme normal değil,olumsuz
bile ygsye sayılı günler kaldı mesaj atıyo amacanız bizi çıldırtmak,olumsuz
geçerken arasından dağların tepelerin geldi veda zamanı devirde edge kaldı yeaa,olumsuz
reklamlarında müthiş bir kalite düşüklüğü var reklam fikri parlak değil prodüksiyon başarısız,olumsuz
hani interneti hızlıydıkandırıldım,olumsuz
artık yeter bıktırdı reklam aday saat gece gündüz yağıyornumaramı satıp sen para kazanıyorsun ben çıldırıyorum,olumsuz
yandaş yalaka hale gelen kullanmıyorum kullanılmasını tavsiye etmiyorum,olumsuz
sadece kazikliyosun hizmet sifir ttnet yolmaya basladin bizi hepinizin allah belasini versin anca semsiye sokuyosunuz insana,olumsuz
lanet olsun sana yaaa kadar para veriyoruz internet felç hakkını verin hız limitimi düşürüyorsun dolandırıcısınız,olumsuz
sabahtan beri net paketi yaptim halde internetimi kullanmadim abv,olumsuz
yine çekmiyor aldıkları para boşuna,olumsuz
kontratım bitsin tövbe,olumsuz
reklam filmi fatihin fedaisi kara murat filminden heyecanlı yeminle eziyet resmen,olumsuz
beni uğraştıran apple bir tutam küfürü hakettinizbedeli ödendi,olumsuz
şuan sinirliyim şerefsizi internet paketimi bitirdikten sonra sosyal paketimden kullanmaya başlayabildim abv,olumsuz
digitürk ttnet para etmezsiniz alayınızın amk,olumsuz
denen illet nedir bilirmisin internet paketim bitti benimle gelirmisin,olumsuz
internetin bitti mesaj atıp durma moralim bozuluyor pislik,olumsuz
sene kahrını çekmişim amk yaa,olumsuz
demin seni övdüm şimdi sövüyorum yaptığım paket değişmiş whywhyhwy abv turkcel,olumsuz
yeter amk eski sevgilimden mesaj atıyosun,olumsuz
kurtulmuş olarak yanlış insanı arıyorsunuz,olumsuz
yavaş internette numara,olumsuz
allah belanı versin,olumsuz
ara sıçtığını düşünüyorum,olumsuz
kadar boktan operatör görmedim,olumsuz
fiyat olarak geçirmeyi iyi biliyorsun hala internet bağlantın leş,olumsuz
i̇nternet paketim dogum günümde bitiyormus ulan yine yaptın yapacagını,olumsuz
kadar kazıkçı hat yok,olumsuz
den türlü kurtulamadık abi,olumsuz
allah seni bildiği yapsin kampanyalarinla ilgilenmiyorum sırf yuzden hattimi taşıyacamzaten internetin cekmiyor,olumsuz
ben kadar kazıkçısını görmedim,olumsuz
ayıp ettin,olumsuz
gözün çıksın parayı sana netin çekmesin bayıldım,olumsuz
reklamındaki gençleri gördükçe gençliğimden utanıyorum lan,olumsuz
i̇nternet paketine söveyim,olumsuz
çekmiyor tarife yok kazık pttcell olsam acep lan,olumsuz
hızda internet olur allahsız felan mısın,olumsuz
sömüre sömüre bırakmadın bizde,olumsuz
bile çekmiyor arkadaş deli etti yada yoğunluk var neci,olumsuz
itina gecedir bana sıkıntı yaratıp duruyorsun yeminle canımı sıkıyorsun,olumsuz
rte den bana bayram mesajı geldiği kınıyorum pis kınıyorum,olumsuz
yavşaksın,olumsuz
utanıyorum itiraf edeyimo mesaj önce bana geldi yarın bırakıyorum,olumsuz
sarı kutudan migros sanal market çeki almayın şifreyi yollamıyorlar rezillik,olumsuz
yedi sülalene sövdüm amk,olumsuz
allah bin belani versin,olumsuz
sakin winnindan kullanmayin yerde iyi cekmiyor sozlesmeyi iptal ettirene kadar canim ciktı,olumsuz
boyunca kazıklıyor ramazanda millet hattını taşımasın böyle yapıyor,olumsuz
den yine kazik yedik artik son idi geciyorum ben,olumsuz
yollarımızı ayırdık mutluyum,olumsuz
nefret ediyorum,olumsuz
yıllardır bizi kazıklıyodu sonunda dayanamadı bize kucak açtı,olumsuz
şerefsiz yeni getiriyorlar kadar bekledim sony xperia yeni geldi amk akşam iyi sövdüm size,olumsuz
off ömrümü yedin,olumsuz
şerefsizsin,olumsuz
ayrı şerefsiz yeminle,olumsuz
allah belanı versin inşallah iflas edersiniz,olumsuz
yerde çekiyorsun fakat fena geçiriyorsun,olumsuz
değil bugün kerim den fena kazık yedi,olumsuz
turbo i̇nternete sakın geçmeyin çevirmeli ağı mumla ararsınız berbat ötesi bağlantı hızı var,olumsuz
net kopması beni deli ediyor havadandır havadan,olumsuz
kandil kilitlenirsin deprem olur titrersingecirdin numara geçirirsinlan allah belanı versin,olumsuz
şerefsiz seferinde internet paketimin bittiğini haber vermiyor bakiyemden yiyor bildiğin hırsızlık amacı düşürmek,olumsuz
allahım konturumu yedi sms yapmadı,olumsuz
reklamlarından irite oldum arkadaş size para veriyoruz ufak depremde hatlar kesilsin,olumsuz
telefonlarının başına buyruk tavırları ayrı sinir bozucu,olumsuz
pahalısın,olumsuz
yıllık hayat bitti allah belanı versin,olumsuz
nefretimi kazandı sefer,olumsuz
artık vodafonea gecmem lazim bıktırdın beni,olumsuz
evin yerinde internet çekmez yerinde telefon zaten çekmez başlıycam onun çekim gücünden,olumsuz
hayat kazıklarla dolubkzson faturam lirakredi kartımın bloke ettiği rakam lirasorunların yarattığı stres paha biçilemez,olumsuz
değilde masraflı,olumsuz
tam bir sömürge sirketi,olumsuz
devlet dinlenme korkusu olmadan gizli bir toplantı yapmak isterse benim eve gelsin bile çekmiyor,olumsuz
saatte felaket yavaş hayrola,olumsuz
bugun bana attigi kaziklara agladim iste hayat devam ediyor,olumsuz
onca zamandan sonra beni gece şair yaptınız helal küfürlerim hayata,olumsuz
bana mesaj atmasın baska sey ıstemıyorum duygularımla oynuyor serefsız,olumsuz
tamam sana uyuz olduğum doğru hattımı iptal etmeyeydin eyiydi,olumsuz
berbat reklam,olumsuz
yedin bitirdin beni askerde yapma hic olmazsa,olumsuz
faturası yatırdım yuh yuh,olumsuz
odemeye gittigim sorunla karsilastigim odemeyi gerceklestiremedigim telefon faturam var,olumsuz
kazıkla kazıklaaa yarın ilk numarayı taşımıyomuyum,olumsuz
kadar başarısız internette görmedim,olumsuz
yemin ediyorum benden kestiği paralarla zengin oldu,olumsuz
allahsız oğrenciden fatura parasi alinirmi lan allahin yokmu senin i̇cim yaniyo icim,olumsuz
lan mal smsi atti,olumsuz
nalet nalet,olumsuz
sonunda eziyetinden kurtuluyorum allaaam,olumsuz
reklamlarından dolayı operatörümden utanıyorum,olumsuz
senin allah belanı versin,olumsuz
internet hızına sokayım,olumsuz
bizim tuvalette internetin cekmiyor,olumsuz
senin ağzına etsinler sevgililerin ayrılma sebebi olacaksın,olumsuz
memnun değilim iptal ettiresim var,olumsuz
aklın yolu birdir yavşak ismi var aldanmayın numara kısa zaman sonra geçiyorum azından abonelerini koparmiyo,olumsuz
sabriyide reklamda oynatttın allah belanı versin,olumsuz
sabri reyiz ilgili onlarca guzel reklam cekilebilirken marka dunyanin mal reklamini cekti,olumsuz
sonunda kurtuldum fakyu,olumsuz
kadar boktan bir operatör olamaz geçtiğim güne lanet olsun,olumsuz
allah belani̇ versi̇n evet versin yaa fatura odeniyor hafta bitiyo paket var hala internet kisitlaniyor yaa,olumsuz
sen lan senin çekmeme lüksün yok,olumsuz
lanet olsun sana günde netimi bitirip hemde iki katı fatura yollandın banaallah sizin evinize ateş düşürsün,olumsuz
arkadaşlar falan çekmiyo çekmiyor hatta,olumsuz
sömürdün bizi,olumsuz
reklamlari saçma ötesi sadece çalışanlarıyla duygu sömürüsü yapıyo,olumsuz
yemin ederim bıktım senden,olumsuz
allah internet hızımı düşüren ateşler salsın,olumsuz
gece gece sövme keyfii,olumsuz
mesajları geç iletiyorsa benim suçum,olumsuz
duygu sömürülü bol aglamaklı reklamlarından sıkılmadık,olumsuz
coca colayla reklamları resmen insanları duygularından vurmak var,olumsuz
kız allah umutlarını sinende bıraksın ocağına ateşler salsın böyle fatura olur laayynn,olumsuz
kadar mal bir operatör tanımıyorum ayar etti beni sabahtan beri,olumsuz
allah kapitalist dünyanın belasini versin soyguncu hizmet si̇fi̇r,olumsuz
senin allah belanı versin bok internet paketi yapmışsın,olumsuz
hayır ben sana sövmekten bıktım sen sövülmekten bıkmadın,olumsuz
telefon nete kada yavaş baglanıyo atcagım twıtı unuttum allahın yok lan,olumsuz
film izleyecektim burnumdan getirdin,olumsuz
reklamlari salak,olumsuz
yarın gidiyim avea geçiyim den hayır yok artık,olumsuz
devlet bir iki hırsızlıkta yarışıyorlar birbirleriyle,olumsuz
kadar hırsız görmedim,olumsuz
bugünde insanların duygularını sömüren saçma sapan bir reklam filmi yayınladı,olumsuz
kadar sacma salak reklam yapmaa basladıı yaa,olumsuz
yine yaptı yapacağını,olumsuz
lanet olsun cok kaziksin amk,olumsuz
allah belani versin,olumsuz
sırf kuruş sesli mesajımı dinleyemiyorum kahrolsun fakirlikkahrolsun,olumsuz
hasstırr internet paketim bitti whatsapp kapandı lanet olsun hayat lanet olsun,olumsuz
alacak düşünen varsa vazgeçsin berbat bişy taksiti var kıramoyrm yoksa duvara yapştırıcam,olumsuz
saçma saçma mesajları atmayı kesermisin lütfen,olumsuz
sanirim suan yesilkoyde bizim eve ugramiyor babam benim telefonumda servis yok diyor,olumsuz
beni sesimden tanır beni sesimden tanır beni eeee allah belanizi versin,olumsuz
bugünün bütün bedduaları internete gelsin çıldırttın beni delirttin kafayı yedirttin,olumsuz
kadar para düşkünü dolandırıcı bir operatör yok yaşasın,olumsuz
reklamında yayvan yayvan konuşan bebeyi duyunca sinirleri tepesine çıkan bir ben miyim yaa,olumsuz
lanet olsun sana,olumsuz
canı sıkıldıkça paramı alıyor bıktım sizden,olumsuz
vodafone boşuna reklam yapıyolar bizim köyde biriside çekmiyor,olumsuz
bodrumda interneti yavas bile iyi çekiyo yaziklar olsun,olumsuz
reklami kadar salakca lan anlamini bilmiyor yazilisini biliyor adam,olumsuz
kadar kazık bir hat yok,olumsuz
kurumsal musteri temsilcisinin babamla imtihani adam geldigine gelecegine pisman oldu,olumsuz
nefret ederek kullandığım şey babet çorabı streç film,olumsuz
kazık,olumsuz
annen ölsün yaa,olumsuz
i̇nternetin yavaşlığı gözlerimi dolduruyo,olumsuz
bir ton para veriyorum adam çekmiyor biraz verip keyfini süreceğim aveaya geçip paraya rezil olacağım,olumsuz
allah belanı versin gün gazete okuyamadım sosyal ağlara giriş işkence oldu zaten dengesizim uğraşıyorum,olumsuz
kadar iğrenç bir operatör yok,olumsuz
reklamları beni küçük çocuklardan soğutuyor,olumsuz
kadar şerefsiz varmıya yüklendiğini internet paketinin yenilenmesinden anlıyorum görünce hemen alıyo,olumsuz
bildiğin adam soyuyor yaa yok böyle bişey başka bir operatöre geçmem meselesi yeter sömürdükler,olumsuz
çözüm getirmedin bari müşteri hizmetlerinden para alma,olumsuz
turkcell beni sesimden tanır derken kendimi dünyanın mal insanıymış hissediyorum,olumsuz
reklamlarındaki insanlar gerçekten kadar gerizekalı,olumsuz
beni şapşal uygulamalarınla hergün biraz vodafoneun kollarına ittiğini bilsen bunca duyarsız olur muydun,olumsuz
cepfaturasi olur hani hayat paylasinca guzeldi allah belani versin,olumsuz
diğerleri çağrı merkezini arayıp müşteri temsilcisi konuştuğumuzda ücretlendiriyor muyoksa usulü kazık,olumsuz
reklamlarini i̇zledi̇kçe gençli̇ği̇mden utaniyorum,olumsuz
bayıldığım paralar haram olsun lan,olumsuz
son gelen telefon faturasindan sonra vodafonea gecmek sart oldu brand loyaltyde yere kadar,olumsuz
reklamlarindaki kucuk kizi alip bogabilirim,olumsuz
digiturk ttnet iptallerine doğru yol alıyorum değişim güzeldi,olumsuz
freezone reklamları çıkınca geçliğimden utandığım doğrudur,olumsuz
tarafindan kaziklanmam disinda cok guzel gun,olumsuz
yerden çekiyomuşbak bak yalana bakodamdayım,olumsuz
artan sms mms hakkimda haram olsun sana,olumsuz
koskoca silivri telefon çekmiyor burayı teğet geçtiyse demek,olumsuz
vodafonea geçtim lanet olası kurtuldum,olumsuz
kadar şerefsiz yok facebook paketi alıyorum sonra paketin yok diyo birde utanmadan paramı alıyo,olumsuz
kadar yüzsüzünü görmedim cevap vermedikçe mesaj atıyor,olumsuz
yine reklamını izledim zarardayım hesap ortada kahrolsun,olumsuz
teknolojini ilerletecek çağı buldun gülüm batırdın beni aptal gerizekalı,olumsuz
dava açalım mesajlar iletilmiyor rezalettir,olumsuz
sosyal paketim olduğuna rağmen krs krs alıp kontürlerimi yiyen allah belanı versin kısa zamanda bırakıcam,olumsuz
paramı aldı paketi yapmadı şimdi saldırıcam,olumsuz
senden nefret ediyorum,olumsuz
sirf yuzden vodofondayim pismanliktir,olumsuz
allah belani versin beni gec sulalemde yasina basan insan yok,olumsuz
hergün mesaj atıyor hattı yaptırdım salaklar farketmediler hala mesaj atıyorlar kontörleri gidiyor kafam yinezehir,olumsuz
allah kere belani versin,olumsuz
internet paketim olduğu halde paralarımı yiyosun zalimsin,olumsuz
kotasız internet istiyorum allah belanı versin,olumsuz
senin kadar serefsizini gormedim,olumsuz
faturamı bir kabartıyor bir kabartıyor ayar oluyorum,olumsuz
birde çekim gücü vardı bok var,olumsuz
vallahi yalan,olumsuz
gecede gelmez faturaya yansırsa seni yaktım,olumsuz
cevizlibağ göbeğinde tercüman sitesinde çekmiyor,olumsuz
eski telefon faturamın ödenmemiş lira borcu varmış ciğerimi yedin doymadınmı amk,olumsuz
internet paketı yapıcaktım aldı lanet olsun yaa,olumsuz
cahit berkaylı reklamından iğreniyorumyok böyle iğrenç reklam resmen,olumsuz
cüzdan uygulaması tam bir felaket korkunç yavaş hatalı birde reklamını yapıyor uygulamanın,olumsuz
seni cok kotu parcalarim kontorlerimi yemekten bikmadin amk,olumsuz
sabah sabah tane mesaj attii yuh,olumsuz
reklam ajansı gerçekten inanılmaz kötü,olumsuz
style den sonra harlem shake reklamlarıda baydı,olumsuz
harlem shake reklaminda saygi cercevesinde danseden gencler sinir bozucu,olumsuz
harlem shake midir nedir hic izlememistim gerzek reklamlari yuzunden kere izledimve kendimden nefret ediyorum,olumsuz
işin foseptiğini çıkarmış artıkşimdi harlem shake versiyon reklam yapmışlar lanet olsun,olumsuz
harlem shake reklamını gördüm artık beyinin bedava olduguna hakikaten inandım salak sarki,olumsuz
bana hayatımın kazığını attı kontör yüklüyom anında bitiyor,olumsuz
sms uğraşlarımız lanet olsun,olumsuz
yükledim şerefsiz paramı aldı ben hayaller kurmuştum halbuki sms yapıcaktım,olumsuz
daglarda tepelerde vadilerde ceken goztepe karsiyaka arasi denizde cekmiyor,olumsuz
reklamın iyisi kötüsü olur arkadasasla almam alanada mani olurum ceon ömrü boyunca rüyasında ahmedim nerdesin görsün insallah,olumsuz
allah belanı versin başka bişey demiyorum,olumsuz
hülya koçyiğitli reklamı sinir bozucu yahu ahmedim nerdesin ahmedim nerdesin ahmedim nerdesin cehennemin dibinde ahmedin,olumsuz
çaycısından kurucusuna kadar sövdüğüm senin ben taaa,olumsuz
gerizekalı öküz salak adi sınırsız paket diyosun günde paramı bitirdin dava edicem süründürücem,olumsuz
internetim yok istinye bir yerde cekmiyor tweeti atabilmem bile mucize,olumsuz
ettiğim küfürü kimseye etmedim,olumsuz
bunu anlamak cok zor olmadi lanet olsun,olumsuz
yedi bitirdi beni arası fatura ödemekten yoruldum,olumsuz
reklamında adamın beş kuruş parası yok tablet alıyor bir saçmalık amk,olumsuz
soydun yine beni olmaz böyle,olumsuz
sana kufur etmeye nerden baslasam bılyorum senn gelmısını gecmısını gelecegını dıgerlerını anladın sen,olumsuz
çift taşıyıcısı olmasa rezil genelde rezil olacaktı herhalde sayın,olumsuz
keremcemli albeni reklamı mustafa sandallı reklamından itici,olumsuz
hayatımda fazla küfür ettiğim operatörüdür güleryüzlü hırsızlığın simgesi olduğunuz allah bin belanızı versin şerefsizler,olumsuz
beni yine ayar etti,olumsuz
sana nasil sovdum belli degil,olumsuz
hayatımda duyduğum saçma cümle turkcell beni sesimden tanır,olumsuz
sen berbat müşteri hizmetine sahipmişsinsenın lanet teknolojin varmışbi sorunu saatte çözemedin reklamlar çöpe,olumsuz
reklami kadar sacma,olumsuz
bugün sana ettiğim kadar kimseye küfür etmedim,olumsuz
style reklamını izledikten sonra olmaktan utandım,olumsuz
allahın cezası yine sms paketimi yeniledi yeter lan isteemiiiyoorum,olumsuz
yeni yıla sevdiklerimizle konuşarak girmek istedik ancak sağolsun çekim kalitesi müsade etmedi,olumsuz
yüzünden sıcak bakmıyorumherşeye para kampanyaları pahalı geliyor diğer firmalara göre,olumsuz
ödediğim faturalarla kendime iphoneipad almıştım kalp hastası ettiniz beni,olumsuz
zamanlaman süper,olumsuz
ilk lanet okuyorum hayatı paylaştıkça maffeden,olumsuz
numaralı telefonumu bilgim imzam dışında sahte evraklarla taşıdınız savcılığa başvuracağım,olumsuz
lan yıldır bize bile vermediniz ayıp,olumsuz
internet gunde nasil biter bana hesap ver bunu eskiden evdeki kullanirdik insaf,olumsuz
eski abonelere yok yada başka kampanya falan pahali memur hattı,olumsuz
yapacağım dalga geçiyorsun,olumsuz
internet paketlerin kadar pahalı lan diğer operatörlerden azmı kazanıyorsunuz anlamıyoruz,olumsuz
dolandiricilar sakin gecmeyin,olumsuz
allah belanızı versin beynim yandı,olumsuz
yanlış gsm yüklemesi yaptım email attım hala geri dönüş yok,olumsuz
sizi tercih ettiğim güne ikici lanet ettim,olumsuz
gitme kal tarifesi çıkarın bence gelene verince gidip gelmek lazım,olumsuz
yau reklami yapiyorsun ocak sozun vardi canlar caliyor dikkat,olumsuz
bile net çekmiyor bir atıp tutmuyorlar olacak süper hiper hızlı hizmeti verinde eksik kalsın,olumsuz
wifi sapıttı,olumsuz
fatura ödedim yoksa hisse aldım anlamadım,olumsuz
sınırsız internet verip hızını sıfıra duşürdüğü uygulamayı lânetle kınıyorum müşterileri madur eden turkcel,olumsuz
sevgili imessage whatsapp kadar yayilmisken lik paketle neyi amaçlıyorsun merak ediyorum,olumsuz
hereke deyimsize bir tweet atmak minimum,olumsuz
millete kampanya sunacağına önce gönderdiğin faturalara bak ulan lira faturamı olur lan allahtan korkmadınız vicdansız,olumsuz
hani heryerden çekiyordun,olumsuz
ttnetdestek internet kesiliyor sürekli arıza aradım kaydı sistemde güncelleme var açılamadı ttnetas iyi varsın,olumsuz
lira fatura ödedim lanet olsun,olumsuz
internet yavaş olsun tamam,olumsuz
bugün tarabyadayim yine yok EMOPOS hala türkiyeyi kapsıyor hala sehrin göbeginde yok,olumsuz
çekmeyen olur lan yapamamislar bunu,olumsuz
yaş grubu ejderhalı bir oyun oynuyorum onu bile telefonumdan açamıyorum internet yavaş,olumsuz
efenim kıbrısta kullanıyoruz paket aşımında değil kitliyorsunuz yaptığınız terbiyesizlik ona göre,olumsuz
maalesef uygulamayı kullanabiliyorum yönlendirdiğiniz siteye girebiliyoruminternetim var giremiyorum,olumsuz
geceleri saatlerde çalışma yapıyorsunuz internet hızı kötü mhizmetlerine bağlanamiyorum numaramı kabul etmiyor,olumsuz
dağlarda denizlerde çeken istanbulum göbeğinde odamda çekmiyor,olumsuz
bitti demek bitmiştir allahınız yok ulan EMONEG,olumsuz
istanbul göbeğinde internetin çekmemesi evin içinde telefonun çekmemesi varken kapsama alanı yalanina son verin ayıp,olumsuz
yeni müşterilerine uygun fiyatta paketler veripeski müşterilerini kazıklayan operatöre denir,olumsuz
hani yerde çekiyordu bilader,olumsuz
internet paketim yaklaşık saattir kapalı wifiyle bağlıyım önce internet paketm bitmiş boşuna msj atma kazıkla geç,olumsuz
senden nefret ediyorum,olumsuz
sakaryanin gozunu seveyim istanbul demissiniz net bile cekmiyo,olumsuz
lanet olası turkcel gece gece nasılda sinirlerimi zıplatıyr insanlrı nasılda aptal yerine koyuyrsunuz kelime oyunu yap kazıkla,olumsuz
hayatım boyunca boyle berbat bır operator görmedım hattımı ıptal edın dıyorum etmıyorlar edınnnnnnnnnnn,olumsuz
bimcell internetinin den hızlı olduğu gerçeği,olumsuz
youtube daki reklamaları baymaya başladı yeter,olumsuz
bir sürü reklam yapıyo internet süper yok amerikayı gectik falan ben yanlış geldim heralde,olumsuz
aboneliğini iptal ettirecek yok benden başka,olumsuz
