tweet,sentiment
türkcell süper lig şampiyonu olmuştur,notr
kopyasindaki gobek atan koca koca adamlar kendilerini gorduklerinde hissediyor,notr
ata demirerli reklamlarına sert olmayan bir cevap fatih ürek,notr
i̇çişleri sivil savunma sizden ulaştırma thypegasusatlas sizden haberleşme turkcelltelsim sizden bankacılık i̇şziraat,notr
cellocanın elindeki global mobile awards ödülü tarafımca fotograflandi medyaya sunuldu buyurunuz EMOPOS gömülü resim kalıcı bağlantı,notr
one direction come turkey directioners smsi olan varmı tanışırız EMOPOS one direction come turkey,notr
merhaba wolfteam oyuncularımobil ödemede yeni dönem başladıpaytogo turkcell hatları geçerli,notr
türk telekom cem yilmazavea ata demi̇rerturkcell şahan gökbakarvodafone şafak sezer,notr
çukurova dava sürecinde rahatlatan karar londra daki yüksek mahkeme altimo yla konusundaki dava,notr
hattı olup içinde olan beri gelsin,notr
askida ekmek super bir turk gelenegimiz varmisama ben bunu cikardi saniyordumcok uzuldum gelenegi bilmedigime EMONEG,notr
masaüstü yazılımı via,notr
tur süper lig fenerbahce istanbul genclerbirligi ankara fuvo prognose runde mrz,notr
bayiinin icine iddaa bayii acan abiyou right,notr
reklamlarında çalışmayan ünlü kaldı,notr
kahramanımız olur musunuz cgd yazıp göndererek anaokulumuzun yapımına katkıda bulunabilirsiniz,notr
götürüp kendi isimi kendim halletmem baya iyi oldu,notr
izmirsel kurumsal hizmetler,notr
nor toplantısında sahne pampişim tuba ekinci nin EMOPOS gömülü resim kalıcı bağlantı,notr
şahan gökbakar şafak sezer vodafone ata demirer avea,notr
yalnızlığını bile yüzüne yüzüne vurur gündür kontür yüklemiyorsunuz,notr
kuzenim yasinda musteri hizmetleriyle konusuyor mahvetti musteri temsilcisini EMOPOS cenebazlik pess EMOPOS,notr
kuzey kıbrıs öncü kadınlarımıza ödül,notr
staj ilanları stajyer avukat i̇stanbul avr EMONEG üniversitelerin hukuk bölü,notr
ayda milyon kâr,notr
yeni yarma balad saat kiiye superonlinedan tllik markafoni hediye eki,notr
saat kişi superonlinedan tllik markafoni hediye çeki kazanıyor,notr
sevgili arkadaslarim sagliginiz yerinizde hos musunuz burada reklamini uzuntuyle karsiladik bir hatir soralim dedik,notr
nceden kutluyor yarmaya hemen katln,notr
superonline dan,notr
anneler günü saat kişiye hediye çeki veriyor,notr
yeni yarışma başladı saat kişiye superonline dan lik markafoni hediye çeki,notr
ortalama bazında hızlı şehri mbps i̇stanbul yavaşı mbps gaziantep oldu,notr
yeni yarışma başladı superonlina dan gecegündüz kazanma şansı,notr
yeni filmi vizyonda fetih harranli emine harvardli emilye karsı,notr
iletısım hızmetlerı fırst quarter results,notr
kartal plaza kartal i̇stanbul others,notr
yine yeni yeniden saat kişiye superonline dan lik markafoni hediye çeki,notr
canım ailem paket kampanyası,notr
hızlı başladı,notr
saat kii superonlinedan tllik markafoni hediye eki kazanyor,notr
anneler saat kiiye hediye eki veriyor,notr
çekilişi saat kişiye hediye çeki veriyor,notr
sayesinde ülkemizin sosyoekonomik geri kalmışlığıkırsalda büyüyen çocuklarının sorununu bir çırpıda çözüldüyaşasın,notr
anneler günü saat kişiye hediye çeki veriyor,notr
kaçırdım üzülme saat kişiye superonline dan lik markafoni hediye çeki,notr
reklamlarında cocuğun kafasında gecen gün küçülüyor EMOPOS,notr
öztürkcell reklamı izle benim öyle kızım yok ayten izle reklamı izle,notr
güney afrika güney afrika kaynak,notr
güney afrika nın birinci gündemi oldu,notr
ecemin son anda zorla elime tutusturdugu tavugu ahahaha bebegim gömülü resim kalıcı bağlantı,notr
güney afrika nın birinci gündemi oldu,notr
sahan ata demirer safak sezer net cem yilmaz nedense faturalar hic guldurmuyor nasil olacak,notr
bence aslanlar disclaimer yazdım evet şimdi iddianamesini okumaya devam,notr
reklam sürelerini biraz uzatırsa ailece film izler çekirdeğimizi alıp karşısına geçicez,notr
tlye yöne mini pakette,notr
allah belani versin senin paket asimsiz netinin amk tweet bile atamiyorum kurtarin bundan beni parasi neyse vercem,notr
uzmanlar yılın davasını tartışıyorturkcellin aleyhine washington federal mahkemesinde dava açtığı mtn ülkesi güne,notr
yenı reklamı fenaa,notr
instagram kullananların faturası ödeniyor heycan anlamadım,notr
zaman cikmaya basladiniz gun oldu kullaniyo hayir vodafone hafta veriyorum size mutluluklar,notr
içine ettiği babaannekıztorun reklamı şahan durumu toparlamış oldu bir doğru sefer bir yanlışı götürdü,notr
aylık nar yapılır,notr
avantajları,notr
nora tokhosepyan reklamında oynamış şimdi haberım oldu ulan onun adını ezberlemek bile kaç gün uğrasmıstım,notr
yöne dakika yöne minik paket yöne paketler tarifesi ndeki minik paket,notr
aleyhine washington federal mahkemesi nde dava açtığı mtn ülkesi güney afrika zor günler geçiriyor,notr
sefer aveaya fırsat vermemiş kendi reklamıyla kendi dalga geçmiş,notr
lütfen garanti̇ hakkindaki̇ yaziyi okuyun garantar türsel,notr
kız ewden kaçıyor üstüne ewleniyor bide çocuğu oluyor sonra babasına mms atıyor barışıyorlar bağlan hayata EMOPOS,notr
papiş sanal bebekleri hatırlar mısın uygulama indirme sitesi tmarket efsane oyuncak sanal bebeği buldum EMOPOS,notr
reklaminda meyılll telafuz edenleri yapcaz,notr
uygulama indirme sitesi tmarket senelerdir aradığım oyuncağın oyununu buldum sanal bebek güzel oyun özlemişim EMOPOS,notr
profesyoneller kulübü nedir üye olunur avantajları nelerdir,notr
beyler azönce bayiisine yükletmeye gittim kasiyer kız numaramı istedi aşıkmı oldu heyecanlıyım EMONEG,notr
sabah hediye etti durup dururken ben bitiremedim hey gidi eski tuketirdikinternet geldimertlik bozuldu,notr
şahan gökbakar olsaydı dede torun reklamı olurdu i̇şte cevabı,notr
reklamı oyle lan,notr
teknoloji tubitak marmara araştırma merkezi gebze yerleşkesi teknoloji serbest bölgesi kocaeli,notr
standından sinsice yaklaşan kız turkcelllimisiniz dedi bende yok piçcellliyim konuşup ödemiyorum faturaları dedim,notr
bulgaristandan beni çaldırp kapatan arkadaşa ödemeli atabilsem süper olmaz dersin,notr
sony xperia mini ayda kampanyası kadar öderimkontrat süresi i̇nterneti içinde almak ister,notr
bazi insanlar bayisinin camindaki kontor bulunur yazisi kadar gereksiz,notr
bir kiza vodafnun konusma surelerini versen anlatacaklari yine bitmiyo yemin ediyorum kendimden biliyorum iste,notr
rehberden turkcell kayıtlı ismi bulmak keypadden rakamlarına tuşladığınızda rehberdeki tur hecesi bulunan kayıtlar geliyr,notr
ben sen yüzden anlaşamadık,notr
platin sponsorluğunda mart tarihlerinde gerçekleştirilecek i̇ltek günleri etkinliği,notr
borç taksitlendirme,notr
avukat bürosunun verdi̇ği̇ mağdurluk,notr
arkadaslar karsılığı kaç kontör atarsınız hattınapls pls plsçok lazımstardolla,notr
gollercepte abonelerine galibiyet primi,notr
senden nefret ediyorum iyi çekiyosun napıyım,notr
kim aramış göstereceğine kimler aramak istemiş gösterseydi herşey bambaşka olabilirdi,notr
özsütte kahve bedava,notr
gelen bilgilendirme mesajına kaç para yazarak cevaplayan babama girişimcilik ödülü vermeli bence,notr
haftalık takımınızın gollerini anında izleyip galibiyete beraberliğe konuşma kazanabilirsiniz,notr
trabzonspor süper lig tarihinde manisasporu avni akerde ilk mağlup etti,notr
simdi tekrar arastirmaya basliyorum cozum bulucam diyolar bakalim neymis degilmis,notr
sayın abonemizden değerli müşterimizi numaramı taşıdıktan sonra yatay geçişimi yapmış bulunmaktayım,notr
aramaya turkcell yazdım twitin aynı bugün bana mesaj atmadı kesin hebealaubp,notr
vodafonemi beğen vodafonesa yorum ¦hangi hat kulanılıyor görelim,notr
arkadaşlar akşam akşam eğlence amaçlı bir yarışma yapmayı planlıyorum varmisiniz kazananın ödülü aveaturkcell sms,notr
gollercepte abonelerine galibiyet primi,notr
merhaba wolfteam oyuncularıturkcell mobil ödeme etkinliği başlıyor hazır mısınızsaat tam,notr
kaç saattir bayisindeyim yaaa şimdide kuaföre geldim,notr
ankara plaza eskişehir yolu söğütözü ankara,notr
merhaba wolfteam oyuncularıi̇lk mobil ödeme etkinliğine katılamadım üzülmeyin mobil,notr
faturam geldi tlsi vergi anlamadım duble yolları ben yaptırıyorum,notr
bahsedilen saat aralıkları aynıysa vodafonelular operatörünü solladı EMOPOS durum acaba,notr
veren sabit nar paketi alın boyunca yurtiçi sabit hatlarla konuşabileceğiniz sahibi olun,notr
işte yararlı bir soru günlerde sana ulaşırız sen bizi yönlendirdiği teyze şikayetci haberin ola,notr
türkiyede foursquare kullanan kullanıcısı bulunuyor,notr
blog ödülleri ocakta the gamede sahiplerini buluyor,notr
serdar ortaç son hiti elimleyi beğendiniz müzikten bugüne özel ücretsiz indirebilirsin EMOPOS,notr
merhaba wolfteam oyuncularıturkcell mobil ödeme etkinliği başladısaat tam itibaren mobil,notr
blog ödülleri ocak sahiplerini buluyor yıl ana sponsorluğunda…,notr
bahçeşehir üniv türkiyeye değer katanları ödüllendiriyor yılki ödül ceosu süreyya cilive takdim edilecek,notr
bahçeşehir üniv türkiyeye değer katanları ödüllendiriyor ödüle yıl ceosu süreyya ciliv değer görüldü,notr
zaman mesaj atmayı düşünsem sms paketi almak ister misiniz mesaj geliyosanırım bir beautiful mind EMOPOS,notr
tepebaşı plaza meşrutiyet beyoğlu i̇stanbul others,notr
goller cepte servisi bedava konuşma dakikaları,notr
bol kopyali sinav haftasi oldu cunku tanri blackberryyi yaratmis,notr
hazır kart lılara yeni yıl müjdesi,notr
akıllı telefon geliyor,notr
sesim kısıldıı içn beni sesimden tanıyamadı waaow demek gerçekten güwenli ben işimi nası halletcem,notr
gollercepte kampanyasıyla konuşma dakikaları kazanın,notr
farkı özel yılbaşı paketi i̇zlemediğim film kalmasın diyenler ayrıntılı bilgi için,notr
bugün işe gelirken yanıma yanaşan gencin hayat paylaşınca güzeltelefon numaranı verir misin demesi bana gücünü gösterdi,notr
plaza umraniye inkilap mahallesi untel sokak istanbul others,notr
did this foursquare tip tepebaşı plaza meyvemix taze sıkılmış meyve suları noktası galatasaray,notr
ruyamda telefon edeceğinde önce telefondan çıkan reklamı dinlemek zorundaydın i̇şim acildi ruya dediğim kabustu,notr
uygulaması gollercepte kazandırıyor cep telefonu operatörü uygulaması gollercepte kaz,notr
baris cubugunu uzatti simdi fatura kesim tarihini bekliyorum kendimi garantiye almak icin EMOPOS,notr
bonnyfooddan özel indirimdetaylı bilgi için,notr
global bilgi,notr
blog ödülleri ocak gecesi sahiplerini buluyor,notr
haber i̇letişim hizmetleri den goller cepte abonelerine galibiyet primi haberindeks,notr
ilk gecis maltepe plaza others,notr
global bilgi i̇nkilap mah üntel sok ümraniye i̇stanbul others,notr
maltepe plaza yeni mahalle pamukkale sokak soğanlık kartal others,notr
goller cepte aboneleri̇ne gali̇bi̇yet pri̇mi̇,notr
salih tozan sok karamancılar i̇ş merkezi esentepe şişli i̇stanbul,notr
gollercepte galibiyete konuşturuyor,notr
gollercepte abonelerine galibiyet primi futbol heyecanını cebe taşıyan uygulaması gollercepte yaln,notr
application yüklendiğinde kendi kendine sistemi çöküyor bazen ararsan mail atıyorlar yardım dosyasını,notr
haber turu futbol dakikalar cepte futbol heyecanını cebe taşıyan uygulaması gollercepte artık cep,notr
bugün gelip ara stüdyoda rap yaptılar sonra bestesi olmayan adam gelip kaça albüm yaparsın sordu,notr
öha sms hakkım yarın bitiyormuş sevgili hadi bana bir kıyak geç dfsety,notr
kafasi buna denir nefes others,notr
ülke ekonomisine milyar lira kazandıracak,notr
mesaj beklerken sevgilim mesaj atmiyormu nasil sinir oluyorum,notr
tim çalışan arkadaşın yardımı lazım,notr
evet evet yanlış duymadınız i̇ki yüz,notr
gonyalının şakası,notr
gizli numarayı engellemecep telefonunuzun arama ekranına yazıp arama tuşuna basınız,notr
şimdi minik paket teki hediyeleri zaman vereceğini açıklarsan iyi olur,notr
soulgazersturkcell sekizden sonrakonserleri temmuz cuma saat web üzerinden canlı yayınla,notr
bana bir iyilik yap uyuyana kadar internet paketim devam etsin,notr
aveadan gönderme dört çeker yakar video,notr
gec güne yapicak uygulamayı yuzden hic üzülmüyorum,notr
birde ummak bulmak ilgili bir atasözümüz varya işte heh tam noktada devreye giriyor,notr
van eğitim seferberliği başlattı kredi kartinla,notr
global bilgi i̇nkilap mah üntel sok ümraniye i̇stanbul,notr
reklamını izlerken aglıycam resmen,notr
‘van i̇çin türkiye kumbarası dolmaya başladı milli eğitim bakanlığı türk eğitim vakfı tev tarafı,notr
bağış yapmak avea van yazıp sms göndermek yeterliymiş bak bunu yaparım işte,notr
amcamın telefonunu arayınca hala karagümrük yanıyor melodisini dinliyorum neredeyse tamamı değiştirdi melodi değişmedi,notr
reklamıyla iyi dalga geçmişte gene dava yiyecek gerizekalılar,notr
yarın ekonomi sayfalarında yer alacak şirket marka kurumlar facebook özak gyo tahincioğlu gayrimenkul botaş dvm,notr
sari arabayla gondermisss EMOPOS,notr
reklamlarda yıldız savaşları pepsi cocacola,notr
aveanın reklamları yaratıcı sıradan vodafoneunki sinir bozucu,notr
meb tev ortaklığı vanda eğitime kalıcı çözüm üretmek türkiye kumbarası projesini başlatarak milyon bağışlamış,notr
bugün mesaj gelmeyince müsteri hizmetlerini arayıp hmm neyse sen mesglsun galiba bye deyip kapattım,notr
arayıp sisteminiz çökmüş herkes beleşe arayabiliyor diyen adam çocukken öğretmene ödev olduğunu hatırlatan yavşaktır,notr
maşallah heryerden reklam toplamış kfc saray halı bakalım görcez,notr
van i̇çin türkiye kumbarası aracılığıyla,notr
yalan dunya reklamdan gecilmiyor niceleri,notr
müzik gruplari komik duruslari goze sokulan markalardenizbankturkcellvs,notr
cihangir gülse birsel sinan çetin nil karaibrahimgil normal şartlar altında beher kapta karıştırılırsa olur,notr
milli eğitim bakanlığı türk eğitim vakfı tev tarafından gerçekleştirilen van i̇çin türkiye,notr
tev meb ısbırlıgı ıle van icın turkıye kumbarasını kurarak egıtım seferberlıgı baslattı,notr
tev meb van öğretmen öğrenci eğitim van yazın bağış,notr
reklam patlaması var EMOPOS yarın çikolata alcam bellonodan yatak kfcden extreme menu EMOPOS,notr
yalan dünya kadar cok reklam yapıyor öyle kfc ohoo,notr
okul öncesi eğitimin yaygınlaştırılmasına destek olmak cgd yazıp gönderebilirsiniz,notr
sıkıntıda heralde sarı jeepi aveaya satığına göre,notr
net paketi nasl yapiliyooo,notr
milyon attı van eğitim seferberliği başlattı,notr
türkiye kumbarasına milyon attı,notr
tev milli eğitim bakanlığı işbirliğiyle van i̇çin türkiye kumbarasını kurarak eğitim seferberliği başlattı,notr
gsm şirketi tarafılan başlatılan proje sunulan haberin sonunda kendini tutamadı türki̇yenin dedi EMOPOS,notr
şahan gökbakaravea ata demirervodafone şafak sezertürk telekom cem yılmaz hepsi,notr
mehmet ali birand haberden sonra üstüne basa basa şirket dedi kızmış sanırım EMOPOS,notr
mehmet ali birand göz göre göre dedi kumbara dedi türkiye dedi aferin dedi,notr
vana yaptığı yardımla ilgili yapılan haberde bir gsm şirketi denildi sadece adı söylenmiyor düşünüyordum,notr
mehmet ali birand reklamini yapti lmao,notr
birand tesekkur ederken kagitlari ucuruyordu daha EMOPOS,notr
reklamında inceden gönderme yapıyor ara,notr
van i̇çin türkiye kumbarası hakimiyetvideo tev milli eğitim bakanlığı işbirliğiyle van i̇çin türkiye kumbarasını,notr
komisyon almam gereken kurum kuruluş varsa listeliyorum ilk sırada var sonra onu twitter takip ediyor,notr
sen yine iyisin benim doğum günümü sadece dsamart kutluyor EMOPOS,notr
kullanan kullanmış olan var varsa facebook tan ulaşsın,notr
telefonum zengin cagini yaşıyorturkcell heryone sms sınırsız internet paketiyle zirveye oynuyor,notr
biride cikip demiyor seytani sokmus ayrintiya,notr
paymo iptal,notr
reklamında turist kız güzel karanfil otu istiyor yaa hayret,notr
egeyi akdenizi kıyı kıyı gezinmiş hee parayıda versene öyle gezdir,notr
android market apn ayarları android,notr
mesaj atti sms diyo bitiyo diyo gün sonra diyooo,notr
öyle bir site biliyorumki bunu vodafon bilse siteyi mahkemeye verir istediğim msj atıyorum yöne,notr
hız rekoru kırdı radikal ekonomi aracılığıyla,notr
superonline iyimail dönemi başladı haber başlığı paylaşıyorum twitterdan hemen,notr
rockçılar yaşlandıkça konser fiyatları artıyor gençliğinde ali sami yende yaşlanınca arenada si̇kti̇r ulan,notr
reklamındakilerin yaşadıkları hayatsa bizimki,notr
geçen gün ciddi ciddi mesaj atmayı denedim,notr
senin hattın hangisi tıkla avantajları gör buraya buraya dikkat espiri çıkabilir,notr
burdayiz yineee EMOPOS cagri merkezi cch,notr
tomanın önüne logosu yakışmış tomayla bağlan hayata,notr
toma reklamı almaya başladı,notr
rezan kiraz akıllı kadınlar kulübünde sizler burçları yorumluyor yay burcu aralık yorumu,notr
vay günlerdi amk süper lig hiiiç bitmesin derdik,notr
göre kişilik problemim var ben onlara göre maria henrry zorlasam maria carey olabilirmiyim,notr
aralık futbolcumuz mehmet topaldan sesi görenler ligine destek,notr
alametifarika yollarını ayırdı,notr
lan arayamiyorum numaram yerde camis yavrusu ayi evladi kayitli oldugundan elti kabul etmedi sanirim,notr
ablamlardan sonra cok karisirdaha cok oteberi insan girip cikar bebisler EMOPOS,notr
lan acundaki reklam aski ucmus iyicene demir roman pegasus derken yakinda beyoglu tsm yede reklam yapacak,notr
kaç aydır kullanıyorum hala sarı veletlerden kapıyı çalıp ben senin selocanınım demedi,notr
turkcell engellere çalim atiyor görme engelli spor federasyonu ana sponsorluğunun yanı sıra görme,notr
engellere çalım atıyor,notr
baba fatura gelmiş telefon yok vurma baba tamam vurma,notr
bir başka konuşmacı aralık çarşamba oturumu cfo önder şenol gömülü resim kalıcı bağlantı,notr
bugün yükledim şok oldu mesaj atacağını şaşırdı alışık değil tabi,notr
yaşlılar sayesinde ayakta duruyorturkcellli olmayan yaşlı yok,notr
akıllı kadınlar kulübünden akıllı öneriler ellerinize i̇yi bakın,notr
telefona lira yüklüyorum internet paketi lira durumda lik vergisi omzuma sıçan martı oluyo,notr
profesyoneller kulübü açık ofis dialoglar çoooook tanıdık,notr
ave derken pocell pttcel bi̇msel ülkercell yakinda eti̇ sell çikarsa şaşirmam sütaşcellde olabi̇li̇r EMOPOS,notr
sen istersen engeller ortadan kalkar dedik futbol ligi sponsoru olduk,notr
dondü dolaştı bize park etti EMOPOS lazer odaklanma kreatif,notr
kaç yıldır kullanıyorum hala sarı veletlerden kapıyı çalıp ben senin selocanınım demedi,notr
arkadaşlar bedelsiz olarak vınn veriyorum aylık sabit lira geliyor vınn sıkıntı yok sadece sınırsız internet alacağım,notr
yeni aldigim telefonumla ilk sms imi yolladim aylar sonra ilk sms,notr
arabacıoğlu genel müdürü aybars karaatmacayı kabul etti ada basını,notr
koltuklar haftaya dolar,notr
üsküpten geldim kartımı taktım yardımcı olabilecek varsa yazsın gömülü resim kalıcı bağlantı,notr
ucledik helikopter eyup belediyesi,notr
maxsi plus beyaz kvk tertemiz garantili,notr
maxsi plus beyaz kvk tertemiz garantili,notr
uefa kararı sonrası trabzon çağrı merkezişöyle futbol şehrininde amına koydunuz helal olsun size gömülü resim kalıcı bağlantı,notr
aşkadamı neyaparneyapmaz aşk tekelin önünü açar yürü kurum der başka bir yapmaz EMOPOS,notr
kuzenımle saat dakıka konustuk kadar yalnızım ıste ararsa bır kuzenım bırde annem arıyor bıle aramıyor,notr
akıllı kadınlar kulübünden akıllı öneriler yünlülerdeki lekeleri sizden korksun,notr
akıllı kadınlar kulübünden akıllı öneriler blucinlerin rengi solmasın,notr
den internet paketi dilendim gömülü resim kalıcı bağlantı,notr
yarım paket bisküvi yarılanmış bir şisesi harici klavye sesi gelen mesajı,notr
fafulye agzini ısırdığımin gömülü resim kalıcı bağlantı,notr
herdan casio fixkim karali çay herdan mis group altınkılıç kefir casio yds publishing bellona permolit vestel vodafone,notr
bir person interest modunda dünyayı ele geçirebileceğimi düşündüm turkcel sesli yanıttaki hata mesajı,notr
ios bayildim kullandigim kullanisli surum heralde ezelden beri kullaniyor,notr
tatil beldesinde aylık toplam internet kullanımı tba yaklaştı,notr
eylül finans kgcgda keyifli bir outdoor takım çalışması yaptık gömülü resim kalıcı bağlantı,notr
sana galaxy ace alırız benimkinin model düşüğü dememden gün sonra gidip sözleşmeyle mini alan annem online,notr
platinium mudur nedir anca baş harfi başlayanların işine yarar ooo okan bey tamam i̇ii isa bey pek olmuyor,notr
tembellik hakki iyi calisilmis online islemlerden yaptigim islemle vakit kazanip vakti degerlendirecegim,notr
beni tek dusunen mesaj atiyo EMOPOS derdim önce telefonum olması gerek,notr
ajans başkanı yapma din kardeşiyiz via,notr
kızla ilgilenme ilgi bekle yok canım işe bakıyo,notr
sırf adında türk geçiyor hattını değiştirmeyen insanlarız türkvatandaşlığına dokundurtmayız,notr
adana ili genelinde internet kesintisi yasanmakta,notr
odtüde kuzey kıbrıs teknoloji buluşması kuzey kıbrıs,notr
nevşehirhaber spk dan gün süre sermaye piyasası kurulu spk hizmetleri son dakika,notr
değilim kimseyi hayata bağlayamam pepsi değilim kimseyi yaşatamam hamal değilim kimseyi,notr
kırıkkale bayi açılışını haziran tarihinde gerçekleştirdik,notr
hirfanlıda temmuz hirfanlı barajındadenizcilik bayramı coşkuyla kutlandı,notr
sosyal i̇nternet paketi,notr
sponsor olduğu stadyum denetimi mayıs tarihinde gerçekleştirildi denetim,notr
avantajlarını kurumsal firmaların yanında küçükorta ölçekli esnafa duyurmak amacıyla ekibimiz,notr
gündoğduda elektrikleri kestiler büyük katliam olacak bugünherkes saklansınturkcell minibusune dikkat,notr
çalışma hayatınızı renklendirecek çılgın bir rehber profesyoneller kulubü via,notr
zeynel tolga suskun den sonra itunes,notr
izmir gundogdu meydani akillandi gömülü resim kalıcı bağlantı,notr
graffiti van reads dont damage its for communication,notr
kalabalıkta çekmeme sorununa çözüm getirmiş,notr
akpliler lozanda montröde öğleden beri bekliyolar yeleklitomalarda basmanede bekliyolarbi dolmuşu garip,notr
superonli̇neda bi̇zden çikti fi̇ber hizi EMOPOS,notr
beni sevmiyor yaa,notr
dunya capinda sorun var diyenlere duyurulurcalisiyoreylem alanlarinda uzerinden calistirmiyorlar olabilir,notr
ankarada arabasıyla gelen araç sivil çıkmış ambulanslarla maskeli polisler taşınıyormuş,notr
sivil polisler insanların arasına karışıyoorlar ambulansların içinde sivil polisler oldugun söyleniyor,notr
izmir acil ankarada olan izmirde olabilirgündoğduda storeun yanında duran içinde sivil polis olabilir,notr
kampanya tencere yada tava yaz gönder devrim cebine gelsin,notr
destege gelmis gundogdu meydani itibari cok kalabalik,notr
kuzey kıbrıs i̇nternetin hedi̇ye kuzey kıbrıs,notr
adwin cinemaximum sinema bileti kazandım sen indir sen kazan,notr
bence yüzden tayyip kayyum atamaya çalışıyor,notr
evet şuan saatte yazıyor olmam evde internet olduğunun bir göstergesidir deneyiminden sonra tekrar,notr
net paketim önce bitti saatte açık bayisi yok acınası bir durum yazanlar kusura bakmasın EMOPOS,notr
haber sitesi kategorisinde vermek için adresine tıklayabilirsiniz,notr
benim dünkü maçta size attığım golleri süper ligde gol kralları maçta atmıyor EMOPOS,notr
diğer arklar sevgiliniz sevgi̇li̇si̇ni̇turkcell kaydetse yapardınız dhahaha yorumlarınızı bekliyorum,notr
kerem bimcell,notr
konusma vermis bugun bitiyo haberim yok,notr
groovesharkimdan istediniz kapatilmis erken dns calisiy neysekiyaziktir playlistlere,notr
aksel gibid,notr
bad boy falan olmaz aksel karın ağrısıysa,notr
aksel lan,notr
kurtlar vadisi asiye melodisi asiye yaz gönderturkcelltelsimaria operatörleri kontör,notr
önce bayisine gittim yüklicektim kadın numarami istedi kesin benden hoşlandı,notr
ttnet ayri felaket zatenona guvenip internet paketini iptal edemiyorum valla EMOPOS,notr
akıllı kadınlar kulübünden akıllı öneriler sıkışan bardaklar,notr
rezan kiraz akıllı kadınlar kulübünde sizler burçları yorumluyor kova burcu kasım yorumu,notr
musteri hizmetleriyle konusurken sesinin ton incelmesini aciklayabilir,notr
arkadaşlarla otururken mesaj geldi sap dolanıyorum sanmasınlar gülümseyerek okudum,notr
bedava dakika konuşma ask fzwp yaz göderturkcell bedava dakika konuşma ask,notr
yolbilgisi ücretsiz seyahat programı,notr
değil reklamındaki panamera taksi şehir içinde kaçla gidiyor,notr
i̇le mobil i̇mza alınır,notr
çocuğum güvende,notr
i̇le türkiye hız rekoru kırdı kurdistannews,notr
reklamı özgür kız EMOPOS,notr
reklamı rol arkadaşı nisa melis telli gömülü resim kalıcı bağlantı,notr
yerde çekerliğine şiir yazarım ayıp olur,notr
online i̇şlemler ücretsiz araç verimlilik programı,notr
galaxy zoom tarifeleri tarifeci tarife bilgileri adreste,notr
sırf sevgilim varmış imajı yaratmak gelen mesajları sırıtarak okuyorum i̇şte bunlar yokluktan,notr
kim sadce sna özl indrm yapyo sil onu çbk,notr
nasil reklam müzi̇ği̇nde slei̇gh bellsi̇ kullanir ulaaaağn,notr
hani görmeyenler vardır diye blogdaki ilk haliyle yeni yazım,notr
ayda yılda bir verdiği smsim aylık süre dolmuş kadar olabilir,notr
