tweet,sentiment
katılıyorum hayır gidiyor millete telefon falan dağıtıryor değirmenin suyu nerden nerden derken tabii,olumlu
müzikte mustafa ceceligizli şarkısını dinliyorum sen dinlemek istersen,olumlu
thy yurtdisindaki firmalardan kaliteli yapiyor buna eminim,olumlu
puan teşekkürler sarı kutudan hediye seçmece,olumlu
whatapp internet paketsiz wifisiz kullanıyorum olmak ayrıcalıktır dıyorum,olumlu
internet paketim bitmisse saat kac olursa olsun itina acik bayisi bulur kontor alirim paket yenilenecek arkadas,olumlu
okey deluxete müzik keyfiyle okey oynuyorum,olumlu
indirim,olumlu
değil iki gündür twittera giriyorum kuruşumu yemedi öptüm,olumlu
i̇ki gün sonra bağlan hayataaa EMOPOS,olumlu
gecenlerde nolari yedeklemeyle geri aldim orta itibaren fln geri verdi numaralarimi sil sil bitmiyo uff,olumlu
şarkı verdi hediye kendin seç indir dedi vay EMOPOS,olumlu
sen adamın dibisinn,olumlu
i̇letişim merkezi hakem elektronik teknoloji uzmanı ümit akarı kutluyorum sorun yumağı haline getirdiğim kurtardığı için EMOPOS,olumlu
güvenli,olumlu
musteri hizmetlerinden twitter uzerinden bile yardim alabiliyorsunuz bravo,olumlu
ucretsiz erisim,olumlu
bedava şarkı indirme linki gönderdi lav,olumlu
türkiyenin hızlı birincisi mbps yüksek bir sonuç ileturkcell oldu,olumlu
yeni reklami super olmus harvard emily harran emine,olumlu
harvardlı emily acılar çekmiş konferansı saniye sonra indirdi diyeharranlı emineye sağladığın imkanlar teşekkürler,olumlu
bi̇m celle geçmeyi̇ sonra yeni̇ kampanyalarini görünce,olumlu
mesajlastigim herkes olsa sms paketini yone yapicam dusunuyorum unutup pisman oluyorum sonra onu unutuyorum,olumlu
eyyy türkiyenin gözde telefon operatörü hattımı hemen taşıyın i̇phone alayım başvurdum bugün,olumlu
kamil koçun kampanyası aldım bileti dönüş bileti indirimli ankaradan gidecekler varsa kampanyalı koltuklar var daha,olumlu
iyisin hossunda bir şahan bulun kardesim cok eziliyoruz karsisinda,olumlu
elestirisini reklamda yapio masallah cok duyarli,olumlu
sizce bir nesil büyümedi markasının sosyal medya kullanımını inceleyen yazım,olumlu
evde kablonet smile var kablonetin calistigini hic gormedim bugun smile yok iphone canavar ipad vodafonela iptal,olumlu
aylık internet paketim kalmış bilgilendirdiğin teşekkürler tek aşkımsın,olumlu
kendiyle dalga gecen öztürk reklamı cok iyi olmuş EMOPOS bence nun demethande reklamları the new,olumlu
şahan gökbakarın sevimli karakter yaratabileceğini hele itici olmayan bir reklam yapabileceğini asla düşünmezdim ama,olumlu
son reklamını yapanı bulup alnından öpesim geldi,olumlu
hahahahah kendi duygusal reklamlarinin ardindan ozturk bey reklamlari yapmasina bayiliyorum,olumlu
artık reklamlarındaki felsefe şubiz kendimizden başka rakip tanımıyoruzturkcell öztürkcell,olumlu
beni seviyor sanırım yine bedava sms gönderdii,olumlu
galatasarayı seviyorum seviyorum ikisi birleşince seviyorum,olumlu
aştı kendini kızııım sandın seni bekliyoruz operatörümüze EMOPOS,olumlu
kredi transferinde heryöne dakika sms hediye tesekkurler kedi olalı fare tuttun EMOPOS,olumlu
bugün internet pakedimin bitiyo olması lazımdı yenilemem mesj falanda geldi hala bitmedi bana aşık,olumlu
ben kadar limit veriyorumvodafone ben kadar limit veriyorumavea bizde veresiye yook EMOPOS,olumlu
olmanın vakti gelmişti oldum,olumlu
beni̇m müşteri̇leri̇ni̇zi̇n memmuni̇yeti̇ni̇ saglayan çalişanlariza ayrica teşekkürü borç bi̇li̇ri̇m hemen aninda dönmeni̇zi̇ tebri̇k etti̇m,olumlu
rehbere baktim olanlar portin yapmis kullanicisi olmuslar mavideki calisanlara sordum kullaniyorlar,olumlu
derde deva bir numara varken vodafoneda öyle bir olay yoktur,olumlu
pek haz etmem vapurlara gazete standi fikrini sevdim,olumlu
anladi derdimden zor durumda oldugumu falan yuzeen yolladi,olumlu
çeker one direction çook şekeer,olumlu
beni mutlu ettin birde hayrına,olumlu
bana hediye konuşma sms hakkı verdi canımsın,olumlu
ooo yone bedava sms varmiss olmaayanlar atsin numaralarinii EMOPOS,olumlu
oha bana iyiliği yapmış olamazsın şaşırdım keşke başka bir isteseydim yahu EMONEG,olumlu
msjlaşmayı seven arkadaşlar geçin boyunca beleş sms kazanın EMOPOS numaranızı taşıyınca,olumlu
sevgili aveayeni reklamin yine buyuklugunu kabul eder sekilde olmusevet cekerhavada karadadenizde gonullerde,olumlu
çeker çağatay şeker EMOPOS,olumlu
aveanın yeni reklamı sağlam bir gönderme olmuş onlar açısından başarılı zaman yerde,olumlu
van yazıp sms atin kumbarada biriksin vanda egitime gitsin turkiyenin gelecegi paylasinca guzel,olumlu
lider olduğunu anlamak kanyon avm deki ti̇m gidin i̇yi varsın yoksa digerlerinin eline kalacaktik,olumlu
türk telekom ankarada kendi kulesinin temelini atarken vanda eğitime desteğin temelini atıyor bravo,olumlu
van yazıp sms göndererek bağışta bulunabilirsiniz teşekkürler,olumlu
aslinda vodafone ezici ustunlugunu kabul edip onunde egilmeleri gerek,olumlu
gold müşteri hattı harikaymış görüşürseniz kuruş alıyor arkadaşlar mtnin değeri kuruş hizmetin öyle,olumlu
yöne dakikam var bana çalışıyor,olumlu
müzikte gökhan tepe adı aşk olsun şarkısını dinliyorum,olumlu
müzikte göksel hasretinle yandı gönlüm şarkısını dinliyorum yapma goksell,olumlu
internet paketim yok wechatten yazilanlar geliyo bna kiyk gecti sss,olumlu
video saniyede indirildi rekoru canlı izliyoruz,olumlu
şimdi tarafından sahurdan sonra bedava ınternet paketı alanlar tweetrda EMOPOS,olumlu
eve internet bağlatmak şart bir olarak kendime ttneti yakıştıramıyorum maalesef fiber altyapı ttnet var yok,olumlu
türklerin aşkla bağlandığı ilk markaturkcellttnetnokiasamsung arçelikcocacolai̇stikbalomocasper elidor,olumlu
çeker baran seker ddd bak bak i̇lti̇fata baak dds,olumlu
bugün telefonda konuştuğum müşteri temsilcisi büşra hanım beni bul olur kapatırken kendinize iyi bakın dedi deli,olumlu
kankim bana bedava verdi,olumlu
müzikte queen you dont fool şarkısını dinliyorum,olumlu
çeker fenerli kızlar şeker dasd,olumlu
teyzeye araba kullandirarak guzel anlatms internet hizini yanniz porshce kimi temsil ediyoonuda soraki reklamda anlicaz heralde,olumlu
kadar olamazdınız sizden halimi hatrımı soruyor ayıp size,olumlu
torpil gecio bana nedirbitsin ugrastikca bitmeyen internetim var,olumlu
gece gülümsememi sağlayan profesyonel club reklamı işler güçler ekibi tabii,olumlu
vee bir işler güçler acun birlikteliğiii profesyoneller kulübü işleri pek keyifli idi acun olmamış,olumlu
iletişim teknoloji fırsat eşitliği sağlayıp toplumumuzun ekonomiksosyal gelişimine katkıda bulunuyor,olumlu
sorun ttnet kaynaklı girdiğimizde ulaşılıyor ttnet deki sorun nedir,olumlu
müzikte linet eylül akşamı şarkısını dinliyorum,olumlu
vodafonee hattı belamı sıktı taktım yine acık artık,olumlu
kadar heryone dakıkası olan varmı aranızda aahahah eyv gömülü resim kalıcı bağlantı,olumlu
bugun bılmem kadar mesaj yolladın kadar bendensin bıldırısı dostlugun dıbıdır»»»,olumlu
müzikte gülşen kendine müslüman şarkısını dinliyorum,olumlu
helal olsun polisin bütün jammer faaliyetlerine rağmen yere arabalarını gönderip ailemizle iletişime geçmemizi sağladı,olumlu
gündoğduda jammer var hatlarda mobil nede kesinlikle cekmiyor tek cekiyor haberiniz olsun,olumlu
alsancaktan çankaya geçmemle beraber cevapsız arama msaj büsürü bildirim kullanıyorum cekmıyorsa diğerleri çkmz,olumlu
gundogduda harici telefonlarda internet cekmiyordu bugun gömülü resim kalıcı bağlantı,olumlu
i̇zmi̇re jammerlara karşi sahi̇le si̇nyal güçlendi̇ri̇ci̇ koymuş teşekkürü borç bi̇li̇ri̇z gömülü resim kalıcı bağlantı,olumlu
müzikte emre altuğ zil şarkısını dinliyorum,olumlu
ceker kiz cok seker neysa ben uyuyayim biraz cümlemize iyi geceler kültürsüz pezolar hariç,olumlu
okan geçmiş emreyle beraber ilk ödemeliyi attık gece gece,olumlu
li̇ olarak i̇lk ti̇vi̇ti̇m,olumlu
superonline bostonda mükemmeliyet ödülü,olumlu
kız arkadaşıma hangi hattı kullanıyorsun dedim avea sen dedi dedim bende kadar yani olmak önemli,olumlu
superonline mükemmeliyet ödülü hürriyet ekonomi̇,olumlu
müzikte ziynet sali dolaşayım damarlarında şarkısını dinliyorum,olumlu
hall fame ödülünü kazanan ilk türk telekomünikasyon şirketi oldu,olumlu
platinum ayrıcalıkları artık cebimdesinema bileti avantajları ile sinema keyfi yaşamak kolay,olumlu
müzikte kazım koyuncugelevera deresi şarkısını dinliyorum sen dinlemek istersen,olumlu
müzikte müslüm gürses sezen aksu sebahat abla şarkısını dinliyorum,olumlu
emina mustafa sandalın reklamına bayılıyorum yakışıyolar valla,olumlu
pahali falan dandik degilmis yeni farkettim,olumlu
tarifeleri aveayı ezer hala aveadayım bir sadakattır arkadaş,olumlu
teşekkürler ayda tlye hislerime tercümanlik yapan kadar insan varsa ayağıma getiriyorsun birde internet ıcın kötü diyorlar,olumlu
limit veriyorumvodafone limit veriyorumavea bizde veresiye yok gardaş,olumlu
reklam şirketini değiştirdi son reklam gayet başarılı,olumlu
taze tutmak sürekli küçük sürprizler yapıyor bizecanım,olumlu
vınn wifi manyak bişey nere gitsem telefon yanımda taşıyorum istediğim yerden internete ıpad ıphone giriyorum EMOPOS,olumlu
sosyal medya reklami cok iyi yaa begendi apartmani dhkdklksks,olumlu
kurumsal hat reklamına çıkan patronların hepsinin hat kullandığına bahse girerim,olumlu
müzikte gülşenyatcaz kalkcaz ordayım şarkısını dinliyorum sen dinlemek istersen,olumlu
müşteriyi mağdur eden gsm operatörünn avea yapıcı operatörün olduğunu biliyor muydunuzbknz,olumlu
bak beleşten sms gönderdi,olumlu
bir yerdeyim sırf öteki gündem var aldım böyle kaliteli programların erken,olumlu
uludağ ‘mobil tatil keyfi kuzey kıbrıs ‘pg tips kampanyasıyla kazandılar kktcell,olumlu
superonlineın hızı dünya ortalamasından kat hızlı,olumlu
müzikte gripinaşk nereden şarkısını dinliyorum sen dinlemek istersen,olumlu
bursaya dair özlediğim tek mbps fiberim olmuş mi̇s,olumlu
sen ani yasarken ben seni heryerde cekemem EMONEG,olumlu
calisan demir isildar,olumlu
bile attığım tribe fazla dayanamayıp sms verdi,olumlu
gnctrkcllli̇yi̇z di̇yoruz ltbde i̇ndi̇ri̇mi̇ kapiyoruz aracılığıyla,olumlu
müzikte ankaralı coşkunankaranın bağları şarkısını dinliyorum sen dinlemek istersen,olumlu
süper müzik kampanyasını duydun,olumlu
artık müşteri hizmetleriyle muhabbet etcem hal hatır soruyolar muhabbet koyu,olumlu
bile cekmedigi yerler varken senin neyine hadsiz reklamlardemekten kendimi alamiyorum,olumlu
hattımı kullanmaya başlıyım ben iyisi,olumlu
koydum telefonumuu onumeee baktım hepsııı,olumlu
bugün türkiye internete fiber teknolojisi bağlanan aileden superonline,olumlu
tim sahiplerini survivora gönderiyor calısanlarınıda tatile romaya yeppa sevdim ben ısı,olumlu
fatura detayı video hazırlamış canımm teşekkürler EMOPOS,olumlu
yarın ilk gitmek herkesin mutluluğu sart,olumlu
kahve diyarı eski anılarla yeni dostlarla kıyağıyla sıcak güzel keşke gitmek gitmek gitmek,olumlu
yeni reklami reklam degil harika bir youtube videosu olmus resmen tekrar tekrar izlenebilir,olumlu
abartıldığı kadar var bile abartmmışlar,olumlu
benimkini kere inceledilersonunda telefonunuz bozuktur dediler geçtim telin arızası düzeliverdi EMOPOS,olumlu
bir coca cola gerçekten sağlam reklam filmleri hazırlıyorlar,olumlu
gece den beleş internet veridi yatıyom kuruyorum alarmı kalkıp internete giriyorum sakfbkjf,olumlu
interneti yapıp bide sınırsız internet paket yapsa var işi götürür adamlar hızlı bide ttnete bak kafa buluyor,olumlu
aylar sonra mesaj attı özlemişim keratayı,olumlu
bana güzellik yaptı heralde hala twitter paketim bitmedi gün sonra biticek mesaj geldi gün oldu,olumlu
yenı reklamı muhtesem olmamıs,olumlu
bitek musteri hizmetlerindeki serkan abi benimle kosulsuz konusuyor yakinda ilk sen kapat kavga edicez aiiioooyyyyyy,olumlu
reklamı ilgi gördü i̇şler güçler oyuncularının bulunduğu yeni reklam filmi tıklanacağa benziyor,olumlu
super olmus EMOPOS ‘üç cihanda dört çeken beylik geli̇yor,olumlu
global bilgi bsi british standarts institute tarafından verilen iso sertifikası alan dünyadaki ilktek çağrı merkezi oldu,olumlu
müzikte cüneyt ergüntaşıdığım kadar varsın şarkısını dinliyorum sen dinlemek istersen,olumlu
arası net verdi hayırdır inşallah,olumlu
dört ceker takip edenler cok seker,olumlu
elif isimli cagri merkezinde uzmanla bir omur filan konusurdum herhalde,olumlu
sen vodafon anı yaşarken ben seni çekemem,olumlu
beri kullanıyorum allah ömür verdikçe başka operatör düşünmüyorum,olumlu
türkiyenin ilk yerli tasarım akıllı telefonu i̇lk yerli tasarım akıllı telefon satışa çıktı,olumlu
satışa sunuldu ilk yerli akıllı telefon sloganıyla geçtiğimiz haftalarda tanıtımını,olumlu
sen anı yaşarkenben seni yerde çekemem,olumlu
müzikte ebru gündeş beyaz şarkısını,olumlu
paketin uygun olup olmadıgını kendi söylüyor arkadaşlar hizmette sınır tanımıyooor,olumlu
abi şuan dan itibaren liyim hıza alışamadım çeken aveanın çubuk çeken sine kaç basar bilemiyorum,olumlu
gibiyiz yerde çekiyoz EMOPOS,olumlu
turkcel limit veriyorumvodafone limit veriyorum aveabizde veresiye yok gardaş günleri unutmadık işte gecirsede,olumlu
kesinlikle interneti yavaş operatörsünüz kadar sinir bozucu bir yavaşlık kigeldiğim geri döneceğim,olumlu
hayatımın sonuna kadar hizmetlerinden fatoşla konuşabilirim egomu okşadı resmen annem bile kadar halimi hatrımı sormuyor,olumlu
sen gi̇bi̇ ani yaşarken ben gi̇bi̇ yerde seni̇ çekemem,olumlu
guzel int sinirsizdi istedigim kullaniyodum ulan vodafoneye gectim int paketi bitmesin gotumu yirtiyom,olumlu
yüzünden interneti sorunlu diyorlar,olumlu
hayat zaten sana güzeldi dimi aynen bana güzel ben,olumlu
‘türkiye nin beğenilen şirketi seçildi,olumlu
geçerim,olumlu
müzikte iron maiden the aftermath şarkısını dinliyorum gömülü resim kalıcı bağlantı,olumlu
müzikte bullet the blue sky remastered şarkısını dinliyorum gömülü resim kalıcı bağlantı,olumlu
esnaf beni affeder reklamı iyi olmuş tebrikler,olumlu
mutluyduz,olumlu
fatih harbiye izliyorum emrenin annesi artık ölmeli yoksa topluca öldürecegiz,olumlu
hakikaten kadar vefalı birini bulamadık,olumlu
vadofoneun çekim gücü çekim gücü bir değil kandırma milleti vadofone,olumlu
bana aydir guzellik yapiyodun askim bedava int veriyodun hala seninleyim yap guzellliikk askim yine yaap int yaaappp,olumlu
sen anı yaşarken ben seni zaman çekemem delikız,olumlu
reklamlarına hayran kaldım sound nedir aşk şeyi affeder out esnaf beni affeder,olumlu
operatörüm seninle gurur duyuyorum,olumlu
turbo internet reklamına kimsenin ses çıkarmaması garip özetle diyor internet hayatınızı skiyor hızlıyız,olumlu
tatlim,olumlu
müzikte mariah carey listesini dinliyorumsen dinle gömülü resim kalıcı bağlantı,olumlu
aralar şımartıyor beni gömülü resim kalıcı bağlantı,olumlu
sms yapinca yaninda bide veriyomuş askim mbciklerimde bitmişti zaten,olumlu
sağolsun bayram mesajı attı olmasa,olumlu
olmasa hal hatır soranın yok hala coolluk derdindesin,olumlu
gençlik bayramında kısa mesajı bedava yapmasıyla kontrolden çıkan sevinçten mesaj atacağını sapıtan nesildik,olumlu
işe bakıyor EMOPOS,olumlu
sebebini bilmediğim bir şekilde tekrardan internete girmeye başladım EMOPOS EMOPOS teşekkürler,olumlu
wireless adisyon açayım istersen çekiyor,olumlu
demiş çekmiyor gömülü resim kalıcı bağlantı,olumlu
birde çekmiyor derler gömülü resim kalıcı bağlantı,olumlu
sevdim,olumlu
aveanın ucuzunu gördüm senefaturalı faturasız EMOPOS dediğim candır bir gün anlarsınız yeğen EMOPOS,olumlu
reklamı şarkıyı uyarlamaları güzel murat muratmuratmurathanoğlu yapmacık tepkileriyle abartmış yineolmamış,olumlu
solumda gerisi yolunda fotoğrafı görüntüle retweet favori,olumlu
kalite isteyen bulan birisi diyelim EMOPOS kanka hoşgeldin kampanyası yaz gerisini halledersin zaten EMOPOS,olumlu
tvda i̇nanılmaz örümcek adam izliyorum,olumlu
müzikte chuck berry johnny goode şarkısını dinliyorum,olumlu
eed yerde dört çeqer,olumlu
avrupanın hızlı büyüme gösteren telekomüniksyon markası ceosu süreyya ciliv iletişim,olumlu
ceosu ciliv avrupanın hızlı büyüyen telekom grubu olduk serhat tezcan bursa bursada konuş,olumlu
avrupanin hizli büyüme gösteren telekomüni̇ksyon markasi avrupanin hizli büyüme gösteren tele,olumlu
avrupanın fazla büyüyen telefonuturkcell ceosu ciliv geleceğin iyi işlerine,olumlu
avropanın sürətli böyümə göstərən telekomüniksyon markası,olumlu
avrupanın hızlı büyüme gösteren telekomüniksyon markası,olumlu
süreyya ciliv avrupanın hızlı büyüyen telekom grubu oldu,olumlu
son yılda avrupanın fazla büyüyeniturkcell ceosu ciliv geleceğin iyi işlerine,olumlu
süreyya ciliv avrupanın hızlı büyüyen telekom grubu oldu ceosu süreyya ciliv,olumlu
konuştukça internet kazan iyiymiş baya yapar,olumlu
ceosu ci̇li̇v avrupanin hizli büyüyen telekom grubu olduk,olumlu
süreyya ciliv avrupanın hızlı büyüyen telekom grubu oldu bursa ceosu süreyya,olumlu
yarin ilk işim dan tekrar gecmek olacak,olumlu
bana mektup yazmış diyor sayın şen btknınn sayılı kararı kapsamında size iade edilmesi gerekmektedir EMOPOS,olumlu
den lik int paketi geldi eyvallah bana eski gunleri hatirlatip tebessum ettirdigin icin EMOPOS,olumlu
internet hizinda rahmet okutturur EMONEG durduğu yerde geçiş yapıyor sürekli,olumlu
müzikte hakan peker kaldı bende şarkısını dinliyorum gömülü resim kalıcı bağlantı,olumlu
hayır anne babamla hattımı asla değişmem hayır anne bizim evde çekmiyo hayır anne ben mutlutum,olumlu
internet paketim var canim benim hemde takma kafani oyle seylere bimcell,olumlu
tego ceker mıgo ümi̇do coq şeker dddd ✌️✌️seviyorum seni kardeşim,olumlu
müzikte ebru gündeş sor bakalım şarkısını dinliyorum gömülü resim kalıcı bağlantı,olumlu
hayr sen yokken vardi bknz dan beri dndhdhhd,olumlu
the walking dead izliyorum,olumlu
global bilgi dünya birincisi oldu özeti görüntüle retweet favori,olumlu
müzikte zeynep bastıkfırçaşarkısını dinliyorum sen dinlemek istersen,olumlu
sephora genç alana bedava kampanyası,olumlu
kamil koç genç kampanyası bilet alana bilet hediye,olumlu
çeker zor çekiyor,olumlu
olan paketin aynısını yapmıs gececem oturdugum yerden internete giremiyorum,olumlu
sephora genç alana bedava kampanyası,olumlu
kamil koç genç kampanyası bilet alana bilet hediye,olumlu
bile hizlisin kralice girmenle cikman bir oluyor EMOPOS,olumlu
çeker benim eda ablamm şekerrr EMOPOS,olumlu
download gördüm tebrikler,olumlu
vinci learning geleceğin platformu üzerinde zengin içerikleriyle yayına başladı,olumlu
aralık arası pazartesi perşembe günü markalı ürünlerde genç alana hedi̇ye,olumlu
canlı hizmet veriyor harikasınız EMOPOS,olumlu
gidiyorum sms yapmadım lira yükledim gün içinde mesaja kuruş harcadım saatte bana günlük sms hediye etti,olumlu
müzikte çelik hercai şarkısını dinliyorum,olumlu
tipi lisansı sadece reklam filmi aracılığıyla,olumlu
bağlamadıktan ben yıl taahütlü vınn aldıktan sonra turktelekom aniden interneti bağlayabileceğini fark etti EMONEG,olumlu
müzikte fazil say summertime from porgy bess şarkısını dinliyorum,olumlu
teşekkürler,olumlu
evet hafta hangi bedava paketini kullaniyoruz,olumlu
bulunduğun çukurdan iyi çekiyor telefonun twit atabiliyorsun,olumlu
chelseagalatasaray izliyorum,olumlu
tek isiniz milleti internete baglamak onu beceremiyorsunuz isini sizden iyi yapiyor gömülü resim kalıcı bağlantı,olumlu
sen anı yaşarken ben seni yerde çekemem,olumlu
müzikte mariah carey all şarkısını dinliyorum,olumlu
canm yaa son gunde internetimi hizlandirdii,olumlu
olum sen vodafondan gecicem demedin,olumlu
müzikte oya bora bana bir masal anlat baba şarkısını dinliyorum,olumlu
dört çeker aytilimiz şeker gömülü resim kalıcı bağlantı,olumlu
müzikte yıldız tilbe seninle i̇şim var şarkısını dinliyorum şi̇mdi̇ bana mutluluk yakişir,olumlu
internetinden aveanın internetine geçince ferrariden inip kağnıya binmiş hissediyorum,olumlu
türksele geçmeyin zaten geçin genç tarife kaçmaz ikili paket var heryöne internet iyi tarife,olumlu
sorun anam babamda var,olumlu
sonunda olduk,olumlu
sen anı yaşarken ben seni yerde çekemem,olumlu
aveanın tam cektigini görmeden ölürsem lanet ettigim simdiden hakkımı helal ediyorum,olumlu
girilen twitter kablonetle ulaşılamaz durumda,olumlu
binlerce kişi avantajlarıyla konuşuyor,olumlu
servis sağlayıcısına bağlı sanırımuydunetten hala girilemiyorttnet hakkında şikayet yazanlar gördümturkcell açtıvs,olumlu
çeker gözde mukavelat şeker EMOPOS,olumlu
sesini duymak istedim reklamı güzel reklam mış şimdi EMOPOS,olumlu
müzikte sezen aksuhala haber bekliyorum senden şarkısını dinliyorum sen dinlemek istersen,olumlu
çevremin bende düşünüyorum olmuyo,olumlu
bana kiyak yaptiiii EMOPOS EMOPOS,olumlu
müzikte zeki müren susma,olumlu
müzikte dumandibine kadar şarkısını dinliyorum sen dinlemek istersen,olumlu
dört çekerben şeker,olumlu
müzikte ferhat göçer sarıl bana sen geldin bahar geldi,olumlu
müzikte sezen aksuşu saniye şarkısını dinliyorum sen dinlemek istersen,olumlu
akıllı depo hatıralarınız güvende aracılığıyla,olumlu
canım operatörüm yap güzellik internet paketim bitti bitiyor yetmiyo örnek sahur yaz yollayalım hadi,olumlu
bacımın sahur interneti sağolsun,olumlu
allah razı olsun zaman,olumlu
saolsun beleş net,olumlu
zamanında dedim dinlemedin şimdi superonlineda sana nazaran güvenli hızlıyız,olumlu
zaman sorun yok EMOPOS şöyle diyebiliriz dostum diğerleri,olumlu
sarikutudan cık twitter facebook paketi verdin allah razı olsun benim facebook paketlerimi twittera ekle,olumlu
önceden geleymisimya bayisine EMOPOS,olumlu
family hug temmuz sayısı yayında ücretsiz olarak linkten dergilik uygulamasından okuyabilirsiniz,olumlu
müzikte yıldız tilbe kardelen şarkısını dinliyorum harıka,olumlu
saniriim acidii halimee smslerimii halaa sonlandirmadii asdfgh,olumlu
müzikte yıldız tilbe aşkıma yenildim şarkısını dinliyorum,olumlu
sen anı yaşarken ben seni yerde çekemem,olumlu
müzikte mika relax take easy şarkısını dinliyorum,olumlu
müzikte sezen aksu yeni yeni kalanlar şarkısını dinliyorum,olumlu
bir ara unutturma zengin oldu anlatacağım kablosuz internet çalışmaz,olumlu
geçen ramazanda beleş sahur paketiyle gece konuşurduk çabuk unuttunuz günleri,olumlu
yapmış yaratıcı bir başarı hikayesine gel sen kariyerini izle,olumlu
müzikte zuhal olcay yalnızlığım şarkısını dinliyorum,olumlu
müzikte halil sezai üşüyorsam şarkısını dinliyorum,olumlu
müzikte i̇rem derici zorun sevgilim şarkısını dinliyorum,olumlu
ttnetten hızlı aralar i̇yice kağnıya bağladınız ama,olumlu
ttnet adsl den bile hızlı valla gömülü resim kalıcı bağlantı,olumlu
müzikte hande yener zalim şarkısını dinliyorum,olumlu
müzikte boyz men mariah carey feat boyz men one sweet day şarkısını dinliyorum,olumlu
hayır bana durduk yere net pakedi verdi ddd,olumlu
müzikte nil karaibrahimgil nil karaibrahimgil kanatlarım var ruhumda küçük eylül meselesi,olumlu
müzikte ziynet sali diken şarkısını dinliyorum gömülü resim kalıcı bağlantı,olumlu
mehmetçiği askercelle çağırıyor özeti görüntüle retweet favori,olumlu
internet paketim bitti hala internetimi kesmedi EMOPOS,olumlu
koy nedir abicim net cekmiyor sebeke ful net sifir allahtan var zorla olsa bakabiliyoruz nete,olumlu
müzikte mehmet erdem i̇lk değil şarkısını dinliyorum gömülü resim kalıcı bağlantı,olumlu
müzikte athena parçalanıyoruz şarkısını dinliyorum durduramıyorum gömülü resim kalıcı bağlantı,olumlu
i̇ki red hattımı iptal edip lira fazla verip platinuma geçiyorum hadi eyvallah,olumlu
eniştemin interneti harıl harıl çekiyo hattı babam diyo bak sen aveaya geçtin param yetmedi diyemedim,olumlu
müzikte yüksek sadakat ben seni arayamam şarkısını dinliyorum gömülü resim kalıcı bağlantı,olumlu
insan bir ayda kere paket yeniler net dakikalarım birike birike hâl oldu aveanın yaşasın cnm,olumlu
tivibu dan sonra fetö kanalını yayın listesinden çıkardıdiger platformlar neyi bekliyorsunuz gömülü resim kalıcı bağlantı,olumlu
tebrikler türkcelldalga dalga genişliyor tivibudan sonra fetö kanalını yayın listesinden çıkardı …özeti görüntüle retweet favori,olumlu
müzikte gokhan tepe kader şarkısını dinliyorum gömülü resim kalıcı bağlantı,olumlu
müzikte sabah kahvesi listesini dinliyorumsen dinle gömülü resim kalıcı bağlantı,olumlu
müzikte fuat saka şimdi yapar şarkısını dinliyorum gömülü resim kalıcı bağlantı,olumlu
müzikte zeki mürengitme sana muhtacım şarkısını dinliyorum sen dinlemek istersen,olumlu
müzikte pilli bebekeylül akşamı şarkısını dinliyorum sen dinlemek istersen,olumlu
orda internet çekiyo farkı,olumlu
anaa canlı sohbet müşteri hizmetleri var sorarsam yardımcı oluyorlar başında hallediyorsun iyi,olumlu
adam sırf yalovadaki vodafonelar kapanıyor hattını taşıdı bahanesini sevdiğim,olumlu
müzikte kargo şairin elinde şarkısını dinliyorum gömülü resim kalıcı bağlantı,olumlu
